         1 0.000000000    10.0.0.1              10.0.0.2              TCP      74     34616 → 19 [SYN] Seq=0 Win=29200 Len=0 MSS=1460 SACK_PERM=1 TSval=133238 TSecr=0 WS=128
         3 0.000425499    10.0.0.1              10.0.0.2              TCP      66     34616 → 19 [ACK] Seq=1 Ack=1 Win=29312 Len=0 TSval=133238 TSecr=682781785
        14 0.001192746    10.0.0.1              10.0.0.2              TCP      66     34616 → 19 [ACK] Seq=1 Ack=75 Win=29312 Len=0 TSval=133238 TSecr=682781785
        17 0.001218361    10.0.0.1              10.0.0.2              TCP      66     34616 → 19 [ACK] Seq=1 Ack=1523 Win=32128 Len=0 TSval=133238 TSecr=682781785
        20 0.001992241    10.0.0.1              10.0.0.2              TCP      66     34616 → 19 [ACK] Seq=1 Ack=2971 Win=35072 Len=0 TSval=133239 TSecr=682781785
        23 0.002022624    10.0.0.1              10.0.0.2              TCP      66     34616 → 19 [ACK] Seq=1 Ack=4419 Win=37888 Len=0 TSval=133239 TSecr=682781785
        26 0.002028984    10.0.0.1              10.0.0.2              TCP      66     34616 → 19 [ACK] Seq=1 Ack=5867 Win=40832 Len=0 TSval=133239 TSecr=682781785
        29 0.002034863    10.0.0.1              10.0.0.2              TCP      66     34616 → 19 [ACK] Seq=1 Ack=7315 Win=43776 Len=0 TSval=133239 TSecr=682781785
        30 0.002043879    10.0.0.1              10.0.0.2              TCP      66     34616 → 19 [ACK] Seq=1 Ack=8763 Win=46592 Len=0 TSval=133239 TSecr=682781785
        31 0.002047361    10.0.0.1              10.0.0.2              TCP      66     34616 → 19 [ACK] Seq=1 Ack=10211 Win=49536 Len=0 TSval=133239 TSecr=682781785
        32 0.002049339    10.0.0.1              10.0.0.2              TCP      66     34616 → 19 [ACK] Seq=1 Ack=11659 Win=52480 Len=0 TSval=133239 TSecr=682781785
        33 0.002052582    10.0.0.1              10.0.0.2              TCP      66     34616 → 19 [ACK] Seq=1 Ack=13107 Win=55296 Len=0 TSval=133239 TSecr=682781785
        34 0.002054415    10.0.0.1              10.0.0.2              TCP      66     34616 → 19 [ACK] Seq=1 Ack=14555 Win=58240 Len=0 TSval=133239 TSecr=682781785
        35 0.002056324    10.0.0.1              10.0.0.2              TCP      66     34616 → 19 [ACK] Seq=1 Ack=16003 Win=61056 Len=0 TSval=133239 TSecr=682781785
        36 0.002058100    10.0.0.1              10.0.0.2              TCP      66     34616 → 19 [ACK] Seq=1 Ack=17451 Win=64000 Len=0 TSval=133239 TSecr=682781785
        37 0.002059802    10.0.0.1              10.0.0.2              TCP      66     34616 → 19 [ACK] Seq=1 Ack=18899 Win=66944 Len=0 TSval=133239 TSecr=682781785
        48 0.002971038    10.0.0.1              10.0.0.2              TCP      66     34616 → 19 [ACK] Seq=1 Ack=20347 Win=69760 Len=0 TSval=133239 TSecr=682781785
        50 0.002999970    10.0.0.1              10.0.0.2              TCP      66     34616 → 19 [ACK] Seq=1 Ack=21795 Win=72704 Len=0 TSval=133239 TSecr=682781785
        52 0.003004603    10.0.0.1              10.0.0.2              TCP      66     34616 → 19 [ACK] Seq=1 Ack=23243 Win=75648 Len=0 TSval=133239 TSecr=682781785
        54 0.003008673    10.0.0.1              10.0.0.2              TCP      66     34616 → 19 [ACK] Seq=1 Ack=24691 Win=78464 Len=0 TSval=133239 TSecr=682781785
        56 0.003012962    10.0.0.1              10.0.0.2              TCP      66     34616 → 19 [ACK] Seq=1 Ack=26139 Win=81408 Len=0 TSval=133239 TSecr=682781785
        58 0.003016998    10.0.0.1              10.0.0.2              TCP      66     34616 → 19 [ACK] Seq=1 Ack=27587 Win=84224 Len=0 TSval=133239 TSecr=682781785
        60 0.003020807    10.0.0.1              10.0.0.2              TCP      66     34616 → 19 [ACK] Seq=1 Ack=29035 Win=87168 Len=0 TSval=133239 TSecr=682781785
        62 0.003024915    10.0.0.1              10.0.0.2              TCP      66     34616 → 19 [ACK] Seq=1 Ack=30483 Win=90112 Len=0 TSval=133239 TSecr=682781785
        64 0.003449593    10.0.0.1              10.0.0.2              TCP      66     34616 → 19 [ACK] Seq=1 Ack=31931 Win=92928 Len=0 TSval=133239 TSecr=682781785
        66 0.003479669    10.0.0.1              10.0.0.2              TCP      66     34616 → 19 [ACK] Seq=1 Ack=33379 Win=95872 Len=0 TSval=133239 TSecr=682781785
        68 0.003484131    10.0.0.1              10.0.0.2              TCP      66     34616 → 19 [ACK] Seq=1 Ack=34827 Win=98816 Len=0 TSval=133239 TSecr=682781785
        70 0.003494772    10.0.0.1              10.0.0.2              TCP      66     34616 → 19 [ACK] Seq=1 Ack=36275 Win=101632 Len=0 TSval=133239 TSecr=682781785
        73 0.003500326    10.0.0.1              10.0.0.2              TCP      66     34616 → 19 [ACK] Seq=1 Ack=37723 Win=104576 Len=0 TSval=133239 TSecr=682781785
        75 0.003504571    10.0.0.1              10.0.0.2              TCP      66     34616 → 19 [ACK] Seq=1 Ack=39171 Win=107392 Len=0 TSval=133239 TSecr=682781785
        76 0.003506496    10.0.0.1              10.0.0.2              TCP      66     34616 → 19 [ACK] Seq=1 Ack=40619 Win=110336 Len=0 TSval=133239 TSecr=682781785
        77 0.003508327    10.0.0.1              10.0.0.2              TCP      66     34616 → 19 [ACK] Seq=1 Ack=42067 Win=113280 Len=0 TSval=133239 TSecr=682781785
        81 0.003962022    10.0.0.1              10.0.0.2              TCP      66     34616 → 19 [ACK] Seq=1 Ack=43515 Win=116096 Len=0 TSval=133239 TSecr=682781785
        83 0.003987022    10.0.0.1              10.0.0.2              TCP      66     34616 → 19 [ACK] Seq=1 Ack=44963 Win=119040 Len=0 TSval=133239 TSecr=682781785
        85 0.003991967    10.0.0.1              10.0.0.2              TCP      66     34616 → 19 [ACK] Seq=1 Ack=46411 Win=121984 Len=0 TSval=133239 TSecr=682781785
        87 0.003996133    10.0.0.1              10.0.0.2              TCP      66     34616 → 19 [ACK] Seq=1 Ack=47859 Win=124800 Len=0 TSval=133239 TSecr=682781785
        89 0.004000359    10.0.0.1              10.0.0.2              TCP      66     34616 → 19 [ACK] Seq=1 Ack=49307 Win=127744 Len=0 TSval=133239 TSecr=682781785
        91 0.004004583    10.0.0.1              10.0.0.2              TCP      66     34616 → 19 [ACK] Seq=1 Ack=50755 Win=130560 Len=0 TSval=133239 TSecr=682781785
        93 0.004008357    10.0.0.1              10.0.0.2              TCP      66     34616 → 19 [ACK] Seq=1 Ack=52203 Win=133504 Len=0 TSval=133239 TSecr=682781785
        95 0.004012744    10.0.0.1              10.0.0.2              TCP      66     34616 → 19 [ACK] Seq=1 Ack=53651 Win=136448 Len=0 TSval=133239 TSecr=682781785
        97 0.004550461    10.0.0.1              10.0.0.2              TCP      66     34616 → 19 [ACK] Seq=1 Ack=55099 Win=139264 Len=0 TSval=133239 TSecr=682781786
        99 0.004579989    10.0.0.1              10.0.0.2              TCP      66     34616 → 19 [ACK] Seq=1 Ack=56547 Win=138624 Len=0 TSval=133239 TSecr=682781786
       101 0.004591199    10.0.0.1              10.0.0.2              TCP      66     34616 → 19 [ACK] Seq=1 Ack=57995 Win=137728 Len=0 TSval=133239 TSecr=682781786
       103 0.004595377    10.0.0.1              10.0.0.2              TCP      66     34616 → 19 [ACK] Seq=1 Ack=59443 Win=136960 Len=0 TSval=133239 TSecr=682781786
       105 0.004599022    10.0.0.1              10.0.0.2              TCP      66     34616 → 19 [ACK] Seq=1 Ack=60891 Win=136064 Len=0 TSval=133239 TSecr=682781786
       107 0.004602931    10.0.0.1              10.0.0.2              TCP      66     34616 → 19 [ACK] Seq=1 Ack=62339 Win=135168 Len=0 TSval=133239 TSecr=682781786
       109 0.004606920    10.0.0.1              10.0.0.2              TCP      66     34616 → 19 [ACK] Seq=1 Ack=63787 Win=134400 Len=0 TSval=133239 TSecr=682781786
       111 0.004610600    10.0.0.1              10.0.0.2              TCP      66     34616 → 19 [ACK] Seq=1 Ack=65235 Win=133504 Len=0 TSval=133239 TSecr=682781786
       112 0.004612596    10.0.0.1              10.0.0.2              TCP      66     34616 → 19 [ACK] Seq=1 Ack=66683 Win=132608 Len=0 TSval=133239 TSecr=682781786
       116 0.005123380    10.0.0.1              10.0.0.2              TCP      66     34616 → 19 [ACK] Seq=1 Ack=68131 Win=132608 Len=0 TSval=133239 TSecr=682781786
       118 0.005151643    10.0.0.1              10.0.0.2              TCP      66     34616 → 19 [ACK] Seq=1 Ack=69579 Win=132608 Len=0 TSval=133239 TSecr=682781786
       120 0.005156610    10.0.0.1              10.0.0.2              TCP      66     34616 → 19 [ACK] Seq=1 Ack=71027 Win=132608 Len=0 TSval=133239 TSecr=682781786
       122 0.005160431    10.0.0.1              10.0.0.2              TCP      66     34616 → 19 [ACK] Seq=1 Ack=72475 Win=132608 Len=0 TSval=133239 TSecr=682781786
       124 0.005164199    10.0.0.1              10.0.0.2              TCP      66     34616 → 19 [ACK] Seq=1 Ack=73923 Win=132608 Len=0 TSval=133239 TSecr=682781786
       126 0.005168058    10.0.0.1              10.0.0.2              TCP      66     34616 → 19 [ACK] Seq=1 Ack=75371 Win=132608 Len=0 TSval=133239 TSecr=682781786
       128 0.005171896    10.0.0.1              10.0.0.2              TCP      66     34616 → 19 [ACK] Seq=1 Ack=78267 Win=132608 Len=0 TSval=133239 TSecr=682781786
       131 0.005640581    10.0.0.1              10.0.0.2              TCP      66     34616 → 19 [ACK] Seq=1 Ack=81163 Win=132608 Len=0 TSval=133239 TSecr=682781786
       134 0.005994973    10.0.0.1              10.0.0.2              TCP      66     34616 → 19 [ACK] Seq=1 Ack=92747 Win=129280 Len=0 TSval=133239 TSecr=682781786
       144 0.051527888    10.0.0.1              10.0.0.2              TCP      66     34616 → 19 [ACK] Seq=1 Ack=120259 Win=113024 Len=0 TSval=133244 TSecr=682781786
       153 0.051954982    10.0.0.1              10.0.0.2              TCP      66     34616 → 19 [ACK] Seq=1 Ack=123155 Win=113024 Len=0 TSval=133244 TSecr=682781798
       166 0.053019543    10.0.0.1              10.0.0.2              TCP      66     34616 → 19 [ACK] Seq=1 Ack=126051 Win=113024 Len=0 TSval=133244 TSecr=682781798
       167 0.053046373    10.0.0.1              10.0.0.2              TCP      66     34616 → 19 [ACK] Seq=1 Ack=128947 Win=113024 Len=0 TSval=133244 TSecr=682781798
       168 0.053049946    10.0.0.1              10.0.0.2              TCP      66     34616 → 19 [ACK] Seq=1 Ack=131843 Win=113024 Len=0 TSval=133244 TSecr=682781798
       171 0.053297088    10.0.0.1              10.0.0.2              TCP      66     34616 → 19 [ACK] Seq=1 Ack=134739 Win=113024 Len=0 TSval=133244 TSecr=682781798
       180 0.101471050    10.0.0.1              10.0.0.2              TCP      66     34616 → 19 [ACK] Seq=1 Ack=163699 Win=96896 Len=0 TSval=133249 TSecr=682781798
       187 0.101796255    10.0.0.1              10.0.0.2              TCP      66     34616 → 19 [ACK] Seq=1 Ack=166595 Win=96896 Len=0 TSval=133249 TSecr=682781810
       196 0.102227767    10.0.0.1              10.0.0.2              TCP      66     34616 → 19 [ACK] Seq=1 Ack=169491 Win=96896 Len=0 TSval=133249 TSecr=682781810
       197 0.102234291    10.0.0.1              10.0.0.2              TCP      66     34616 → 19 [ACK] Seq=1 Ack=172387 Win=96896 Len=0 TSval=133249 TSecr=682781810
       198 0.102237292    10.0.0.1              10.0.0.2              TCP      66     34616 → 19 [ACK] Seq=1 Ack=175283 Win=96896 Len=0 TSval=133249 TSecr=682781810
       214 0.151472514    10.0.0.1              10.0.0.2              TCP      66     34616 → 19 [ACK] Seq=1 Ack=205691 Win=79744 Len=0 TSval=133254 TSecr=682781810
       221 0.151800979    10.0.0.1              10.0.0.2              TCP      66     34616 → 19 [ACK] Seq=1 Ack=208587 Win=79744 Len=0 TSval=133254 TSecr=682781823
       230 0.152256832    10.0.0.1              10.0.0.2              TCP      66     34616 → 19 [ACK] Seq=1 Ack=211483 Win=79744 Len=0 TSval=133254 TSecr=682781823
       231 0.152276386    10.0.0.1              10.0.0.2              TCP      66     34616 → 19 [ACK] Seq=1 Ack=214379 Win=79744 Len=0 TSval=133254 TSecr=682781823
       232 0.152280495    10.0.0.1              10.0.0.2              TCP      66     34616 → 19 [ACK] Seq=1 Ack=217275 Win=79744 Len=0 TSval=133254 TSecr=682781823
       237 0.152438949    10.0.0.1              10.0.0.2              TCP      66     34616 → 19 [ACK] Seq=1 Ack=220171 Win=79744 Len=0 TSval=133254 TSecr=682781823
       252 0.201461417    10.0.0.1              10.0.0.2              TCP      66     34616 → 19 [ACK] Seq=1 Ack=252027 Win=66944 Len=0 TSval=133259 TSecr=682781823
       259 0.201798120    10.0.0.1              10.0.0.2              TCP      66     34616 → 19 [ACK] Seq=1 Ack=254923 Win=66944 Len=0 TSval=133259 TSecr=682781835
       268 0.202222979    10.0.0.1              10.0.0.2              TCP      66     34616 → 19 [ACK] Seq=1 Ack=257819 Win=66944 Len=0 TSval=133259 TSecr=682781835
       269 0.202225351    10.0.0.1              10.0.0.2              TCP      66     34616 → 19 [ACK] Seq=1 Ack=260715 Win=66944 Len=0 TSval=133259 TSecr=682781835
       270 0.202227479    10.0.0.1              10.0.0.2              TCP      66     34616 → 19 [ACK] Seq=1 Ack=263611 Win=66944 Len=0 TSval=133259 TSecr=682781835
       275 0.202441154    10.0.0.1              10.0.0.2              TCP      66     34616 → 19 [ACK] Seq=1 Ack=266507 Win=66944 Len=0 TSval=133259 TSecr=682781835
       292 0.251462874    10.0.0.1              10.0.0.2              TCP      66     34616 → 19 [ACK] Seq=1 Ack=301259 Win=52480 Len=0 TSval=133264 TSecr=682781835
       299 0.251798440    10.0.0.1              10.0.0.2              TCP      66     34616 → 19 [ACK] Seq=1 Ack=304155 Win=52480 Len=0 TSval=133264 TSecr=682781848
       308 0.252233103    10.0.0.1              10.0.0.2              TCP      66     34616 → 19 [ACK] Seq=1 Ack=307051 Win=52480 Len=0 TSval=133264 TSecr=682781848
       309 0.252251541    10.0.0.1              10.0.0.2              TCP      66     34616 → 19 [ACK] Seq=1 Ack=309947 Win=52480 Len=0 TSval=133264 TSecr=682781848
       312 0.252425837    10.0.0.1              10.0.0.2              TCP      66     34616 → 19 [ACK] Seq=1 Ack=312843 Win=52480 Len=0 TSval=133264 TSecr=682781848
       313 0.252442122    10.0.0.1              10.0.0.2              TCP      66     34616 → 19 [ACK] Seq=1 Ack=315739 Win=52480 Len=0 TSval=133264 TSecr=682781848
       332 0.256496010    10.0.0.1              10.0.0.2              TCP      66     34616 → 19 [ACK] Seq=1 Ack=350491 Win=43136 Len=0 TSval=133264 TSecr=682781848
       359 0.301401291    10.0.0.1              10.0.0.2              TCP      66     34616 → 19 [ACK] Seq=1 Ack=388139 Win=29568 Len=0 TSval=133269 TSecr=682781849
       366 0.301710607    10.0.0.1              10.0.0.2              TCP      66     34616 → 19 [ACK] Seq=1 Ack=391035 Win=29568 Len=0 TSval=133269 TSecr=682781860
       373 0.302064743    10.0.0.1              10.0.0.2              TCP      66     34616 → 19 [ACK] Seq=1 Ack=393931 Win=29568 Len=0 TSval=133269 TSecr=682781860
       374 0.302070279    10.0.0.1              10.0.0.2              TCP      66     34616 → 19 [ACK] Seq=1 Ack=396827 Win=29568 Len=0 TSval=133269 TSecr=682781860
       381 0.302422036    10.0.0.1              10.0.0.2              TCP      66     34616 → 19 [ACK] Seq=1 Ack=399723 Win=29568 Len=0 TSval=133269 TSecr=682781860
       382 0.302447218    10.0.0.1              10.0.0.2              TCP      66     34616 → 19 [ACK] Seq=1 Ack=402619 Win=29568 Len=0 TSval=133269 TSecr=682781860
       395 0.351494288    10.0.0.1              10.0.0.2              TCP      66     34616 → 19 [ACK] Seq=1 Ack=431579 Win=12544 Len=0 TSval=133274 TSecr=682781860
       404 0.401413670    10.0.0.1              10.0.0.2              TCP      66     34616 → 19 [ACK] Seq=1 Ack=443163 Win=1024 Len=0 TSval=133279 TSecr=682781873
       406 0.623737863    10.0.0.1              10.0.0.2              TCP      66     [TCP ZeroWindow] 34616 → 19 [ACK] Seq=1 Ack=444187 Win=0 Len=0 TSval=133301 TSecr=682781941
       408 0.843708108    10.0.0.1              10.0.0.2              TCP      66     [TCP ZeroWindow] 34616 → 19 [ACK] Seq=1 Ack=444187 Win=0 Len=0 TSval=133323 TSecr=682781941
       409 1.128787278    10.0.0.1              10.0.0.2              TCP      66     [TCP Window Update] 34616 → 19 [ACK] Seq=1 Ack=444187 Win=14464 Len=0 TSval=133351 TSecr=682781941
       415 1.129184782    10.0.0.1              10.0.0.2              TCP      66     34616 → 19 [ACK] Seq=1 Ack=444611 Win=14464 Len=0 TSval=133351 TSecr=682782067
       416 1.129207549    10.0.0.1              10.0.0.2              TCP      66     34616 → 19 [ACK] Seq=1 Ack=447507 Win=14464 Len=0 TSval=133351 TSecr=682782067
       419 1.129446163    10.0.0.1              10.0.0.2              TCP      66     34616 → 19 [ACK] Seq=1 Ack=450403 Win=14464 Len=0 TSval=133351 TSecr=682782067
       422 1.129493459    10.0.0.1              10.0.0.2              TCP      66     34616 → 19 [ACK] Seq=1 Ack=453299 Win=14464 Len=0 TSval=133351 TSecr=682782067
       425 1.129770271    10.0.0.1              10.0.0.2              TCP      66     34616 → 19 [ACK] Seq=1 Ack=456195 Win=14464 Len=0 TSval=133351 TSecr=682782067
       428 1.130101142    10.0.0.1              10.0.0.2              TCP      66     34616 → 19 [ACK] Seq=1 Ack=459091 Win=14464 Len=0 TSval=133351 TSecr=682782067
       436 1.171534476    10.0.0.1              10.0.0.2              TCP      66     34616 → 19 [ACK] Seq=1 Ack=472123 Win=1536 Len=0 TSval=133356 TSecr=682782067
       438 1.221511835    10.0.0.1              10.0.0.2              TCP      66     34616 → 19 [ACK] Seq=1 Ack=473571 Win=128 Len=0 TSval=133361 TSecr=682782078
       440 1.439693888    10.0.0.1              10.0.0.2              TCP      66     [TCP ZeroWindow] 34616 → 19 [ACK] Seq=1 Ack=473699 Win=0 Len=0 TSval=133382 TSecr=682782145
       441 1.561045173    10.0.0.1              10.0.0.2              TCP      66     [TCP Window Update] 34616 → 19 [ACK] Seq=1 Ack=473699 Win=11904 Len=0 TSval=133394 TSecr=682782145
       447 1.561487738    10.0.0.1              10.0.0.2              TCP      66     34616 → 19 [ACK] Seq=1 Ack=476467 Win=11904 Len=0 TSval=133394 TSecr=682782175
       450 1.561556333    10.0.0.1              10.0.0.2              TCP      66     34616 → 19 [ACK] Seq=1 Ack=479363 Win=11904 Len=0 TSval=133395 TSecr=682782175
       453 1.561863610    10.0.0.1              10.0.0.2              TCP      66     34616 → 19 [ACK] Seq=1 Ack=482259 Win=11904 Len=0 TSval=133395 TSecr=682782175
       456 1.561974798    10.0.0.1              10.0.0.2              TCP      66     34616 → 19 [ACK] Seq=1 Ack=485155 Win=11904 Len=0 TSval=133395 TSecr=682782175
       462 1.611541280    10.0.0.1              10.0.0.2              TCP      66     34616 → 19 [ACK] Seq=1 Ack=496739 Win=384 Len=0 TSval=133400 TSecr=682782175
       464 1.831763868    10.0.0.1              10.0.0.2              TCP      66     [TCP ZeroWindow] 34616 → 19 [ACK] Seq=1 Ack=497123 Win=0 Len=0 TSval=133422 TSecr=682782243
       466 2.047657855    10.0.0.1              10.0.0.2              TCP      66     [TCP ZeroWindow] 34616 → 19 [ACK] Seq=1 Ack=497123 Win=0 Len=0 TSval=133443 TSecr=682782243
       467 2.433122629    10.0.0.1              10.0.0.2              TCP      66     [TCP Window Update] 34616 → 19 [ACK] Seq=1 Ack=497123 Win=15232 Len=0 TSval=133482 TSecr=682782243
       473 2.433587936    10.0.0.1              10.0.0.2              TCP      66     34616 → 19 [ACK] Seq=1 Ack=498187 Win=15232 Len=0 TSval=133482 TSecr=682782393
       474 2.433639481    10.0.0.1              10.0.0.2              TCP      66     34616 → 19 [ACK] Seq=1 Ack=501083 Win=15232 Len=0 TSval=133482 TSecr=682782393
       477 2.433682410    10.0.0.1              10.0.0.2              TCP      66     34616 → 19 [ACK] Seq=1 Ack=503979 Win=15232 Len=0 TSval=133482 TSecr=682782393
       480 2.433984302    10.0.0.1              10.0.0.2              TCP      66     34616 → 19 [ACK] Seq=1 Ack=506875 Win=15232 Len=0 TSval=133482 TSecr=682782393
       483 2.434220143    10.0.0.1              10.0.0.2              TCP      66     34616 → 19 [ACK] Seq=1 Ack=509771 Win=15232 Len=0 TSval=133482 TSecr=682782393
       493 2.481516390    10.0.0.1              10.0.0.2              TCP      78     34616 → 19 [ACK] Seq=1 Ack=524251 Win=14464 Len=0 TSval=133487 TSecr=682782393 SLE=522803 SRE=524251
       503 2.531592663    10.0.0.1              10.0.0.2              TCP      66     34616 → 19 [ACK] Seq=1 Ack=537283 Win=13568 Len=0 TSval=133492 TSecr=682782405
       508 2.531938686    10.0.0.1              10.0.0.2              TCP      66     34616 → 19 [ACK] Seq=1 Ack=540179 Win=13568 Len=0 TSval=133492 TSecr=682782418
       516 2.581606164    10.0.0.1              10.0.0.2              TCP      66     34616 → 19 [ACK] Seq=1 Ack=553211 Win=640 Len=0 TSval=133497 TSecr=682782418
       518 2.803720367    10.0.0.1              10.0.0.2              TCP      66     [TCP ZeroWindow] 34616 → 19 [ACK] Seq=1 Ack=553851 Win=0 Len=0 TSval=133519 TSecr=682782486
       519 2.865451351    10.0.0.1              10.0.0.2              TCP      66     [TCP Window Update] 34616 → 19 [ACK] Seq=1 Ack=553851 Win=11008 Len=0 TSval=133525 TSecr=682782486
       525 2.865793459    10.0.0.1              10.0.0.2              TCP      66     34616 → 19 [ACK] Seq=1 Ack=556107 Win=11008 Len=0 TSval=133525 TSecr=682782501
       528 2.866024213    10.0.0.1              10.0.0.2              TCP      66     34616 → 19 [ACK] Seq=1 Ack=559003 Win=11008 Len=0 TSval=133525 TSecr=682782501
       531 2.866143259    10.0.0.1              10.0.0.2              TCP      66     34616 → 19 [ACK] Seq=1 Ack=561899 Win=11008 Len=0 TSval=133525 TSecr=682782501
       534 2.866370655    10.0.0.1              10.0.0.2              TCP      66     34616 → 19 [ACK] Seq=1 Ack=564795 Win=11008 Len=0 TSval=133525 TSecr=682782501
       537 2.866489288    10.0.0.1              10.0.0.2              TCP      66     34616 → 19 [ACK] Seq=1 Ack=567691 Win=11008 Len=0 TSval=133525 TSecr=682782501
       542 2.911623216    10.0.0.1              10.0.0.2              TCP      66     34616 → 19 [ACK] Seq=1 Ack=577827 Win=896 Len=0 TSval=133530 TSecr=682782501
       544 3.131751344    10.0.0.1              10.0.0.2              TCP      66     [TCP ZeroWindow] 34616 → 19 [ACK] Seq=1 Ack=578723 Win=0 Len=0 TSval=133552 TSecr=682782568
       546 3.347756756    10.0.0.1              10.0.0.2              TCP      66     [TCP ZeroWindow] 34616 → 19 [ACK] Seq=1 Ack=578723 Win=0 Len=0 TSval=133573 TSecr=682782568
       547 3.737581529    10.0.0.1              10.0.0.2              TCP      66     [TCP Window Update] 34616 → 19 [ACK] Seq=1 Ack=578723 Win=11008 Len=0 TSval=133612 TSecr=682782568
       553 3.738032743    10.0.0.1              10.0.0.2              TCP      66     34616 → 19 [ACK] Seq=1 Ack=579275 Win=11008 Len=0 TSval=133612 TSecr=682782719
       554 3.738051627    10.0.0.1              10.0.0.2              TCP      66     34616 → 19 [ACK] Seq=1 Ack=582171 Win=11008 Len=0 TSval=133612 TSecr=682782719
       560 3.781660716    10.0.0.1              10.0.0.2              TCP      66     34616 → 19 [ACK] Seq=1 Ack=592307 Win=896 Len=0 TSval=133617 TSecr=682782719
       562 3.999800360    10.0.0.1              10.0.0.2              TCP      66     [TCP ZeroWindow] 34616 → 19 [ACK] Seq=1 Ack=593203 Win=0 Len=0 TSval=133638 TSecr=682782785
       564 4.215700611    10.0.0.1              10.0.0.2              TCP      66     [TCP ZeroWindow] 34616 → 19 [ACK] Seq=1 Ack=593203 Win=0 Len=0 TSval=133660 TSecr=682782785
       565 4.605903008    10.0.0.1              10.0.0.2              TCP      66     [TCP Window Update] 34616 → 19 [ACK] Seq=1 Ack=593203 Win=14464 Len=0 TSval=133699 TSecr=682782785
       571 4.606340909    10.0.0.1              10.0.0.2              TCP      66     34616 → 19 [ACK] Seq=1 Ack=593755 Win=14464 Len=0 TSval=133699 TSecr=682782936
       572 4.606358679    10.0.0.1              10.0.0.2              TCP      66     34616 → 19 [ACK] Seq=1 Ack=596651 Win=14464 Len=0 TSval=133699 TSecr=682782936
       575 4.606386435    10.0.0.1              10.0.0.2              TCP      66     34616 → 19 [ACK] Seq=1 Ack=599547 Win=14464 Len=0 TSval=133699 TSecr=682782936
       578 4.606719474    10.0.0.1              10.0.0.2              TCP      66     34616 → 19 [ACK] Seq=1 Ack=602443 Win=14464 Len=0 TSval=133699 TSecr=682782936
       581 4.606811870    10.0.0.1              10.0.0.2              TCP      66     34616 → 19 [ACK] Seq=1 Ack=605339 Win=14464 Len=0 TSval=133699 TSecr=682782936
       589 4.651691702    10.0.0.1              10.0.0.2              TCP      66     34616 → 19 [ACK] Seq=1 Ack=618371 Win=13568 Len=0 TSval=133704 TSecr=682782936
       594 4.652037066    10.0.0.1              10.0.0.2              TCP      66     34616 → 19 [ACK] Seq=1 Ack=621267 Win=13568 Len=0 TSval=133704 TSecr=682782948
       602 4.701609809    10.0.0.1              10.0.0.2              TCP      66     34616 → 19 [ACK] Seq=1 Ack=634299 Win=640 Len=0 TSval=133709 TSecr=682782948
       604 4.919800325    10.0.0.1              10.0.0.2              TCP      66     [TCP ZeroWindow] 34616 → 19 [ACK] Seq=1 Ack=634939 Win=0 Len=0 TSval=133730 TSecr=682783015
       605 5.041684257    10.0.0.1              10.0.0.2              TCP      66     [TCP Window Update] 34616 → 19 [ACK] Seq=1 Ack=634939 Win=11008 Len=0 TSval=133743 TSecr=682783015
       613 5.042088548    10.0.0.1              10.0.0.2              TCP      66     34616 → 19 [ACK] Seq=1 Ack=637195 Win=11008 Len=0 TSval=133743 TSecr=682783045
       616 5.042228311    10.0.0.1              10.0.0.2              TCP      66     34616 → 19 [ACK] Seq=1 Ack=640091 Win=11008 Len=0 TSval=133743 TSecr=682783045
       619 5.042369669    10.0.0.1              10.0.0.2              TCP      66     34616 → 19 [ACK] Seq=1 Ack=642987 Win=11008 Len=0 TSval=133743 TSecr=682783045
       622 5.042641859    10.0.0.1              10.0.0.2              TCP      66     34616 → 19 [ACK] Seq=1 Ack=645883 Win=11008 Len=0 TSval=133743 TSecr=682783045
       625 5.042672802    10.0.0.1              10.0.0.2              TCP      66     34616 → 19 [ACK] Seq=1 Ack=648779 Win=11008 Len=0 TSval=133743 TSecr=682783045
       630 5.091719799    10.0.0.1              10.0.0.2              TCP      66     34616 → 19 [ACK] Seq=1 Ack=658915 Win=896 Len=0 TSval=133748 TSecr=682783045
       632 5.311790079    10.0.0.1              10.0.0.2              TCP      66     [TCP ZeroWindow] 34616 → 19 [ACK] Seq=1 Ack=659811 Win=0 Len=0 TSval=133770 TSecr=682783113
       633 5.477961928    10.0.0.1              10.0.0.2              TCP      66     [TCP Window Update] 34616 → 19 [ACK] Seq=1 Ack=659811 Win=15232 Len=0 TSval=133786 TSecr=682783113
       645 5.521748079    10.0.0.1              10.0.0.2              TCP      66     34616 → 19 [ACK] Seq=1 Ack=674843 Win=256 Len=0 TSval=133791 TSecr=682783154
       647 5.739714830    10.0.0.1              10.0.0.2              TCP      66     [TCP ZeroWindow] 34616 → 19 [ACK] Seq=1 Ack=675099 Win=0 Len=0 TSval=133812 TSecr=682783220
       649 5.959710290    10.0.0.1              10.0.0.2              TCP      66     [TCP ZeroWindow] 34616 → 19 [ACK] Seq=1 Ack=675099 Win=0 Len=0 TSval=133834 TSecr=682783220
       651 6.782261243    10.0.0.1              10.0.0.2              TCP      66     [TCP Window Update] 34616 → 19 [ACK] Seq=1 Ack=675099 Win=12032 Len=0 TSval=133917 TSecr=682783220
       657 6.782752771    10.0.0.1              10.0.0.2              TCP      66     34616 → 19 [ACK] Seq=1 Ack=676291 Win=12032 Len=0 TSval=133917 TSecr=682783480
       658 6.782779501    10.0.0.1              10.0.0.2              TCP      66     34616 → 19 [ACK] Seq=1 Ack=679187 Win=12032 Len=0 TSval=133917 TSecr=682783480
       661 6.782806154    10.0.0.1              10.0.0.2              TCP      66     34616 → 19 [ACK] Seq=1 Ack=682083 Win=12032 Len=0 TSval=133917 TSecr=682783480
       664 6.783108549    10.0.0.1              10.0.0.2              TCP      66     34616 → 19 [ACK] Seq=1 Ack=684979 Win=12032 Len=0 TSval=133917 TSecr=682783480
       667 6.783398826    10.0.0.1              10.0.0.2              TCP      66     34616 → 19 [ACK] Seq=1 Ack=687875 Win=12032 Len=0 TSval=133917 TSecr=682783480
       670 6.783771990    10.0.0.1              10.0.0.2              TCP      66     34616 → 19 [ACK] Seq=1 Ack=690771 Win=12032 Len=0 TSval=133917 TSecr=682783480
       671 6.831753134    10.0.0.1              10.0.0.2              TCP      66     34616 → 19 [ACK] Seq=1 Ack=693667 Win=9216 Len=0 TSval=133922 TSecr=682783481
       678 6.881791682    10.0.0.1              10.0.0.2              TCP      66     34616 → 19 [ACK] Seq=1 Ack=702355 Win=640 Len=0 TSval=133927 TSecr=682783493
       680 7.103588746    10.0.0.1              10.0.0.2              TCP      66     [TCP ZeroWindow] 34616 → 19 [ACK] Seq=1 Ack=702995 Win=0 Len=0 TSval=133949 TSecr=682783561
       682 7.323708435    10.0.0.1              10.0.0.2              TCP      66     [TCP ZeroWindow] 34616 → 19 [ACK] Seq=1 Ack=702995 Win=0 Len=0 TSval=133971 TSecr=682783561
       683 7.650599023    10.0.0.1              10.0.0.2              TCP      66     [TCP Window Update] 34616 → 19 [ACK] Seq=1 Ack=702995 Win=14208 Len=0 TSval=134003 TSecr=682783561
       689 7.651045330    10.0.0.1              10.0.0.2              TCP      66     34616 → 19 [ACK] Seq=1 Ack=703803 Win=14208 Len=0 TSval=134003 TSecr=682783697
       690 7.651065567    10.0.0.1              10.0.0.2              TCP      66     34616 → 19 [ACK] Seq=1 Ack=706699 Win=14208 Len=0 TSval=134003 TSecr=682783697
       693 7.651088941    10.0.0.1              10.0.0.2              TCP      66     34616 → 19 [ACK] Seq=1 Ack=709595 Win=14208 Len=0 TSval=134003 TSecr=682783697
       696 7.651385245    10.0.0.1              10.0.0.2              TCP      66     34616 → 19 [ACK] Seq=1 Ack=712491 Win=14208 Len=0 TSval=134003 TSecr=682783697
       699 7.651608357    10.0.0.1              10.0.0.2              TCP      66     34616 → 19 [ACK] Seq=1 Ack=715387 Win=14208 Len=0 TSval=134003 TSecr=682783697
       702 7.651910046    10.0.0.1              10.0.0.2              TCP      66     34616 → 19 [ACK] Seq=1 Ack=718283 Win=14208 Len=0 TSval=134003 TSecr=682783698
       703 7.701856182    10.0.0.1              10.0.0.2              TCP      66     34616 → 19 [ACK] Seq=1 Ack=721179 Win=12544 Len=0 TSval=134009 TSecr=682783698
       712 7.751841199    10.0.0.1              10.0.0.2              TCP      66     34616 → 19 [ACK] Seq=1 Ack=732763 Win=1024 Len=0 TSval=134014 TSecr=682783710
       714 7.975769268    10.0.0.1              10.0.0.2              TCP      66     [TCP ZeroWindow] 34616 → 19 [ACK] Seq=1 Ack=733787 Win=0 Len=0 TSval=134036 TSecr=682783779
       716 8.195709802    10.0.0.1              10.0.0.2              TCP      66     [TCP ZeroWindow] 34616 → 19 [ACK] Seq=1 Ack=733787 Win=0 Len=0 TSval=134058 TSecr=682783779
       717 8.308467743    10.0.0.1              10.0.0.2              TCP      71     [TCP ZeroWindow] 34616 → 19 [PSH, ACK] Seq=1 Ack=733787 Win=0 Len=5 TSval=134069 TSecr=682783779
       719 8.308993393    10.0.0.1              10.0.0.2              TCP      66     [TCP Window Update] 34616 → 19 [ACK] Seq=6 Ack=733787 Win=11008 Len=0 TSval=134069 TSecr=682783862
       725 8.309433925    10.0.0.1              10.0.0.2              TCP      66     34616 → 19 [ACK] Seq=6 Ack=734211 Win=11008 Len=0 TSval=134069 TSecr=682783862
       726 8.309452200    10.0.0.1              10.0.0.2              TCP      66     34616 → 19 [ACK] Seq=6 Ack=737107 Win=11008 Len=0 TSval=134069 TSecr=682783862
       729 8.309533416    10.0.0.1              10.0.0.2              TCP      66     34616 → 19 [ACK] Seq=6 Ack=740003 Win=11008 Len=0 TSval=134069 TSecr=682783862
       732 8.309811764    10.0.0.1              10.0.0.2              TCP      66     34616 → 19 [ACK] Seq=6 Ack=742899 Win=16128 Len=0 TSval=134069 TSecr=682783862
       735 8.309880512    10.0.0.1              10.0.0.2              TCP      66     34616 → 19 [ACK] Seq=6 Ack=745795 Win=16128 Len=0 TSval=134069 TSecr=682783862
       738 8.310185315    10.0.0.1              10.0.0.2              TCP      66     34616 → 19 [ACK] Seq=6 Ack=748691 Win=16128 Len=0 TSval=134069 TSecr=682783862
       741 8.310420683    10.0.0.1              10.0.0.2              TCP      66     34616 → 19 [ACK] Seq=6 Ack=751587 Win=14464 Len=0 TSval=134069 TSecr=682783862
       744 8.310455724    10.0.0.1              10.0.0.2              TCP      66     34616 → 19 [ACK] Seq=6 Ack=754483 Win=16896 Len=0 TSval=134069 TSecr=682783862
       749 8.311086661    10.0.0.1              10.0.0.2              TCP      66     34616 → 19 [ACK] Seq=6 Ack=760275 Win=13568 Len=0 TSval=134069 TSecr=682783862
       750 8.311128112    10.0.0.1              10.0.0.2              TCP      66     34616 → 19 [ACK] Seq=6 Ack=763171 Win=16896 Len=0 TSval=134069 TSecr=682783862
       761 8.311712174    10.0.0.1              10.0.0.2              TCP      66     34616 → 19 [ACK] Seq=6 Ack=771859 Win=11904 Len=0 TSval=134069 TSecr=682783862
       766 8.312508997    10.0.0.1              10.0.0.2              TCP      66     34616 → 19 [ACK] Seq=6 Ack=783443 Win=76672 Len=0 TSval=134070 TSecr=682783863
       773 8.312960492    10.0.0.1              10.0.0.2              TCP      66     34616 → 19 [ACK] Seq=6 Ack=787787 Win=74880 Len=0 TSval=134070 TSecr=682783863
       789 8.313690660    10.0.0.1              10.0.0.2              TCP      66     34616 → 19 [ACK] Seq=6 Ack=800819 Win=67328 Len=0 TSval=134070 TSecr=682783863
       800 8.314075540    10.0.0.1              10.0.0.2              TCP      66     34616 → 19 [ACK] Seq=6 Ack=803715 Win=69888 Len=0 TSval=134070 TSecr=682783863
       803 8.314647672    10.0.0.1              10.0.0.2              TCP      66     34616 → 19 [ACK] Seq=6 Ack=831227 Win=62208 Len=0 TSval=134070 TSecr=682783863
       824 8.315325262    10.0.0.1              10.0.0.2              TCP      66     34616 → 19 [ACK] Seq=6 Ack=834123 Win=64768 Len=0 TSval=134070 TSecr=682783863
       825 8.315414330    10.0.0.1              10.0.0.2              TCP      66     34616 → 19 [ACK] Seq=6 Ack=842811 Win=59648 Len=0 TSval=134070 TSecr=682783863
       835 8.315668151    10.0.0.1              10.0.0.2              TCP      66     34616 → 19 [ACK] Seq=6 Ack=845707 Win=61312 Len=0 TSval=134070 TSecr=682783863
       838 8.316372177    10.0.0.1              10.0.0.2              TCP      66     34616 → 19 [ACK] Seq=6 Ack=876115 Win=43520 Len=0 TSval=134070 TSecr=682783863
       861 8.317090329    10.0.0.1              10.0.0.2              TCP      66     34616 → 19 [ACK] Seq=6 Ack=887699 Win=36608 Len=0 TSval=134070 TSecr=682783864
       870 8.317861677    10.0.0.1              10.0.0.2              TCP      66     34616 → 19 [ACK] Seq=6 Ack=910867 Win=23936 Len=0 TSval=134070 TSecr=682783864
       881 8.318715592    10.0.0.1              10.0.0.2              TCP      66     34616 → 19 [ACK] Seq=6 Ack=934035 Win=768 Len=0 TSval=134070 TSecr=682783864
       882 8.318733232    10.0.0.1              10.0.0.2              TCP      66     [TCP Window Update] 34616 → 19 [ACK] Seq=6 Ack=934035 Win=15360 Len=0 TSval=134070 TSecr=682783864
       893 8.319442503    10.0.0.1              10.0.0.2              TCP      66     34616 → 19 [ACK] Seq=6 Ack=948515 Win=896 Len=0 TSval=134070 TSecr=682783864
       894 8.319926505    10.0.0.1              10.0.0.2              TCP      66     [TCP Window Update] 34616 → 19 [ACK] Seq=6 Ack=948515 Win=15360 Len=0 TSval=134070 TSecr=682783864
       905 8.320608516    10.0.0.1              10.0.0.2              TCP      66     34616 → 19 [ACK] Seq=6 Ack=962995 Win=896 Len=0 TSval=134070 TSecr=682783865
       906 8.321960178    10.0.0.1              10.0.0.2              TCP      66     [TCP Window Update] 34616 → 19 [ACK] Seq=6 Ack=962995 Win=139264 Len=0 TSval=134071 TSecr=682783865
       930 8.322641831    10.0.0.1              10.0.0.2              TCP      66     34616 → 19 [ACK] Seq=6 Ack=964443 Win=142208 Len=0 TSval=134071 TSecr=682783865
       932 8.322660589    10.0.0.1              10.0.0.2              TCP      66     34616 → 19 [ACK] Seq=6 Ack=965891 Win=145152 Len=0 TSval=134071 TSecr=682783865
       934 8.322664216    10.0.0.1              10.0.0.2              TCP      66     34616 → 19 [ACK] Seq=6 Ack=967339 Win=147968 Len=0 TSval=134071 TSecr=682783865
       936 8.322667541    10.0.0.1              10.0.0.2              TCP      66     34616 → 19 [ACK] Seq=6 Ack=968787 Win=150912 Len=0 TSval=134071 TSecr=682783865
       938 8.322670939    10.0.0.1              10.0.0.2              TCP      66     34616 → 19 [ACK] Seq=6 Ack=970235 Win=153728 Len=0 TSval=134071 TSecr=682783865
       940 8.322674401    10.0.0.1              10.0.0.2              TCP      66     34616 → 19 [ACK] Seq=6 Ack=971683 Win=156672 Len=0 TSval=134071 TSecr=682783865
       942 8.322677817    10.0.0.1              10.0.0.2              TCP      66     34616 → 19 [ACK] Seq=6 Ack=973131 Win=159616 Len=0 TSval=134071 TSecr=682783865
       945 8.322682484    10.0.0.1              10.0.0.2              TCP      66     34616 → 19 [ACK] Seq=6 Ack=974579 Win=162432 Len=0 TSval=134071 TSecr=682783865
       947 8.322998822    10.0.0.1              10.0.0.2              TCP      66     34616 → 19 [ACK] Seq=6 Ack=976027 Win=165376 Len=0 TSval=134071 TSecr=682783865
       949 8.323016065    10.0.0.1              10.0.0.2              TCP      66     34616 → 19 [ACK] Seq=6 Ack=977475 Win=168320 Len=0 TSval=134071 TSecr=682783865
       951 8.323019539    10.0.0.1              10.0.0.2              TCP      66     34616 → 19 [ACK] Seq=6 Ack=978923 Win=171136 Len=0 TSval=134071 TSecr=682783865
       953 8.323022824    10.0.0.1              10.0.0.2              TCP      66     34616 → 19 [ACK] Seq=6 Ack=980371 Win=174080 Len=0 TSval=134071 TSecr=682783865
       955 8.323026235    10.0.0.1              10.0.0.2              TCP      66     34616 → 19 [ACK] Seq=6 Ack=981819 Win=176896 Len=0 TSval=134071 TSecr=682783865
       957 8.323029694    10.0.0.1              10.0.0.2              TCP      66     34616 → 19 [ACK] Seq=6 Ack=983267 Win=179840 Len=0 TSval=134071 TSecr=682783865
       959 8.323033020    10.0.0.1              10.0.0.2              TCP      66     34616 → 19 [ACK] Seq=6 Ack=984715 Win=182784 Len=0 TSval=134071 TSecr=682783865
       961 8.323036305    10.0.0.1              10.0.0.2              TCP      66     34616 → 19 [ACK] Seq=6 Ack=986163 Win=185600 Len=0 TSval=134071 TSecr=682783865
       963 8.323401616    10.0.0.1              10.0.0.2              TCP      66     34616 → 19 [ACK] Seq=6 Ack=987611 Win=188544 Len=0 TSval=134071 TSecr=682783865
       965 8.323405865    10.0.0.1              10.0.0.2              TCP      66     34616 → 19 [ACK] Seq=6 Ack=989059 Win=191488 Len=0 TSval=134071 TSecr=682783865
       967 8.323409286    10.0.0.1              10.0.0.2              TCP      66     34616 → 19 [ACK] Seq=6 Ack=990507 Win=194304 Len=0 TSval=134071 TSecr=682783865
       969 8.323412842    10.0.0.1              10.0.0.2              TCP      66     34616 → 19 [ACK] Seq=6 Ack=991955 Win=197248 Len=0 TSval=134071 TSecr=682783865
       971 8.323416393    10.0.0.1              10.0.0.2              TCP      66     34616 → 19 [ACK] Seq=6 Ack=993403 Win=200064 Len=0 TSval=134071 TSecr=682783865
       973 8.323446760    10.0.0.1              10.0.0.2              TCP      66     34616 → 19 [ACK] Seq=6 Ack=994851 Win=203008 Len=0 TSval=134071 TSecr=682783865
       975 8.323464242    10.0.0.1              10.0.0.2              TCP      66     34616 → 19 [ACK] Seq=6 Ack=996299 Win=205952 Len=0 TSval=134071 TSecr=682783865
