     24 13.256629345   192.168.2.219         192.168.2.15          TCP      58     39739 → 53 [SYN] Seq=0 Win=1024 Len=0 MSS=1460
     25 13.256659798   192.168.2.219         192.168.2.15          TCP      58     39739 → 25 [SYN] Seq=0 Win=1024 Len=0 MSS=1460
     26 13.256669533   192.168.2.219         192.168.2.15          TCP      58     39739 → 22 [SYN] Seq=0 Win=1024 Len=0 MSS=1460
     27 13.256677609   192.168.2.219         192.168.2.15          TCP      58     39739 → 21 [SYN] Seq=0 Win=1024 Len=0 MSS=1460
     28 13.256684619   192.168.2.219         192.168.2.15          TCP      58     39739 → 23 [SYN] Seq=0 Win=1024 Len=0 MSS=1460
     29 13.256692345   192.168.2.219         192.168.2.15          TCP      58     39739 → 80 [SYN] Seq=0 Win=1024 Len=0 MSS=1460
     30 13.256701815   192.168.2.219         192.168.2.15          TCP      58     39739 → 66 [SYN] Seq=0 Win=1024 Len=0 MSS=1460
     31 13.256709521   192.168.2.219         192.168.2.15          TCP      58     39739 → 14 [SYN] Seq=0 Win=1024 Len=0 MSS=1460
     32 13.256716141   192.168.2.219         192.168.2.15          TCP      58     39739 → 34 [SYN] Seq=0 Win=1024 Len=0 MSS=1460
     33 13.256723932   192.168.2.219         192.168.2.15          TCP      58     39739 → 28 [SYN] Seq=0 Win=1024 Len=0 MSS=1460
     38 13.257920132   192.168.2.219         192.168.2.15          TCP      54     39739 → 80 [RST] Seq=1 Win=0 Len=0
     40 13.257934573   192.168.2.219         192.168.2.15          TCP      54     39739 → 22 [RST] Seq=1 Win=0 Len=0
     48 14.358101864   192.168.2.219         192.168.2.15          TCP      58     39739 → 31 [SYN] Seq=0 Win=1024 Len=0 MSS=1460
     49 14.358133591   192.168.2.219         192.168.2.15          TCP      58     39739 → 79 [SYN] Seq=0 Win=1024 Len=0 MSS=1460
     50 14.358142291   192.168.2.219         192.168.2.15          TCP      58     39739 → 8 [SYN] Seq=0 Win=1024 Len=0 MSS=1460
     51 14.358151427   192.168.2.219         192.168.2.15          TCP      58     39739 → 100 [SYN] Seq=0 Win=1024 Len=0 MSS=1460
     52 14.358159438   192.168.2.219         192.168.2.15          TCP      58     39739 → 41 [SYN] Seq=0 Win=1024 Len=0 MSS=1460
     53 14.358167988   192.168.2.219         192.168.2.15          TCP      58     39739 → 19 [SYN] Seq=0 Win=1024 Len=0 MSS=1460
     54 14.358176654   192.168.2.219         192.168.2.15          TCP      58     39739 → 67 [SYN] Seq=0 Win=1024 Len=0 MSS=1460
     55 14.358183184   192.168.2.219         192.168.2.15          TCP      58     39739 → 78 [SYN] Seq=0 Win=1024 Len=0 MSS=1460
     56 14.358191690   192.168.2.219         192.168.2.15          TCP      58     39739 → 64 [SYN] Seq=0 Win=1024 Len=0 MSS=1460
     57 14.358198660   192.168.2.219         192.168.2.15          TCP      58     39739 → 90 [SYN] Seq=0 Win=1024 Len=0 MSS=1460
     58 14.358205731   192.168.2.219         192.168.2.15          TCP      58     39739 → 81 [SYN] Seq=0 Win=1024 Len=0 MSS=1460
     59 14.358214001   192.168.2.219         192.168.2.15          TCP      58     39739 → 24 [SYN] Seq=0 Win=1024 Len=0 MSS=1460
     60 14.358220492   192.168.2.219         192.168.2.15          TCP      58     39739 → 35 [SYN] Seq=0 Win=1024 Len=0 MSS=1460
     61 14.358226772   192.168.2.219         192.168.2.15          TCP      58     39739 → 87 [SYN] Seq=0 Win=1024 Len=0 MSS=1460
     62 14.358233183   192.168.2.219         192.168.2.15          TCP      58     39739 → 55 [SYN] Seq=0 Win=1024 Len=0 MSS=1460
     63 14.358239648   192.168.2.219         192.168.2.15          TCP      58     39739 → 15 [SYN] Seq=0 Win=1024 Len=0 MSS=1460
     64 14.358247014   192.168.2.219         192.168.2.15          TCP      58     39739 → 16 [SYN] Seq=0 Win=1024 Len=0 MSS=1460
     65 14.358253219   192.168.2.219         192.168.2.15          TCP      58     39739 → 82 [SYN] Seq=0 Win=1024 Len=0 MSS=1460
     66 14.358259384   192.168.2.219         192.168.2.15          TCP      58     39739 → 68 [SYN] Seq=0 Win=1024 Len=0 MSS=1460
     67 14.358266815   192.168.2.219         192.168.2.15          TCP      58     39739 → 7 [SYN] Seq=0 Win=1024 Len=0 MSS=1460
     68 14.358273100   192.168.2.219         192.168.2.15          TCP      58     39739 → 85 [SYN] Seq=0 Win=1024 Len=0 MSS=1460
     69 14.358279216   192.168.2.219         192.168.2.15          TCP      58     39739 → 69 [SYN] Seq=0 Win=1024 Len=0 MSS=1460
     70 14.358285946   192.168.2.219         192.168.2.15          TCP      58     39739 → 5 [SYN] Seq=0 Win=1024 Len=0 MSS=1460
     71 14.358293342   192.168.2.219         192.168.2.15          TCP      58     39739 → 42 [SYN] Seq=0 Win=1024 Len=0 MSS=1460
     72 14.358300697   192.168.2.219         192.168.2.15          TCP      58     39739 → 3 [SYN] Seq=0 Win=1024 Len=0 MSS=1460
     73 14.358306948   192.168.2.219         192.168.2.15          TCP      58     39739 → 94 [SYN] Seq=0 Win=1024 Len=0 MSS=1460
     74 14.358313073   192.168.2.219         192.168.2.15          TCP      58     39739 → 30 [SYN] Seq=0 Win=1024 Len=0 MSS=1460
     75 14.358320703   192.168.2.219         192.168.2.15          TCP      58     39739 → 12 [SYN] Seq=0 Win=1024 Len=0 MSS=1460
     76 14.358328269   192.168.2.219         192.168.2.15          TCP      58     39739 → 98 [SYN] Seq=0 Win=1024 Len=0 MSS=1460
     77 14.358334690   192.168.2.219         192.168.2.15          TCP      58     39739 → 51 [SYN] Seq=0 Win=1024 Len=0 MSS=1460
     78 14.358341115   192.168.2.219         192.168.2.15          TCP      58     39739 → 62 [SYN] Seq=0 Win=1024 Len=0 MSS=1460
     79 14.358349481   192.168.2.219         192.168.2.15          TCP      58     39739 → 49 [SYN] Seq=0 Win=1024 Len=0 MSS=1460
     80 14.358357106   192.168.2.219         192.168.2.15          TCP      58     39739 → 10 [SYN] Seq=0 Win=1024 Len=0 MSS=1460
     81 14.358363652   192.168.2.219         192.168.2.15          TCP      58     39739 → 88 [SYN] Seq=0 Win=1024 Len=0 MSS=1460
     82 14.358370657   192.168.2.219         192.168.2.15          TCP      58     39739 → 92 [SYN] Seq=0 Win=1024 Len=0 MSS=1460
     83 14.358377707   192.168.2.219         192.168.2.15          TCP      58     39739 → 59 [SYN] Seq=0 Win=1024 Len=0 MSS=1460
     84 14.358384363   192.168.2.219         192.168.2.15          TCP      58     39739 → 13 [SYN] Seq=0 Win=1024 Len=0 MSS=1460
     85 14.358390643   192.168.2.219         192.168.2.15          TCP      58     39739 → 77 [SYN] Seq=0 Win=1024 Len=0 MSS=1460
     86 14.358398839   192.168.2.219         192.168.2.15          TCP      58     39739 → 20 [SYN] Seq=0 Win=1024 Len=0 MSS=1460
     87 14.358406414   192.168.2.219         192.168.2.15          TCP      58     39739 → 32 [SYN] Seq=0 Win=1024 Len=0 MSS=1460
     88 14.358414975   192.168.2.219         192.168.2.15          TCP      58     39739 → 71 [SYN] Seq=0 Win=1024 Len=0 MSS=1460
     89 14.358421670   192.168.2.219         192.168.2.15          TCP      58     39739 → 17 [SYN] Seq=0 Win=1024 Len=0 MSS=1460
     90 14.358427856   192.168.2.219         192.168.2.15          TCP      58     39739 → 18 [SYN] Seq=0 Win=1024 Len=0 MSS=1460
     91 14.358435106   192.168.2.219         192.168.2.15          TCP      58     39739 → 1 [SYN] Seq=0 Win=1024 Len=0 MSS=1460
     92 14.358443847   192.168.2.219         192.168.2.15          TCP      58     39739 → 72 [SYN] Seq=0 Win=1024 Len=0 MSS=1460
     93 14.358451582   192.168.2.219         192.168.2.15          TCP      58     39739 → 39 [SYN] Seq=0 Win=1024 Len=0 MSS=1460
     94 14.358459988   192.168.2.219         192.168.2.15          TCP      58     39739 → 52 [SYN] Seq=0 Win=1024 Len=0 MSS=1460
     95 14.358467239   192.168.2.219         192.168.2.15          TCP      58     39739 → 44 [SYN] Seq=0 Win=1024 Len=0 MSS=1460
     96 14.358474319   192.168.2.219         192.168.2.15          TCP      58     39739 → 95 [SYN] Seq=0 Win=1024 Len=0 MSS=1460
     97 14.358481679   192.168.2.219         192.168.2.15          TCP      58     39739 → 76 [SYN] Seq=0 Win=1024 Len=0 MSS=1460
    103 14.360746482   192.168.2.219         192.168.2.15          TCP      58     39739 → 74 [SYN] Seq=0 Win=1024 Len=0 MSS=1460
    104 14.360779944   192.168.2.219         192.168.2.15          TCP      58     39739 → 4 [SYN] Seq=0 Win=1024 Len=0 MSS=1460
    105 14.360789135   192.168.2.219         192.168.2.15          TCP      58     39739 → 37 [SYN] Seq=0 Win=1024 Len=0 MSS=1460
    106 14.360795975   192.168.2.219         192.168.2.15          TCP      58     39739 → 47 [SYN] Seq=0 Win=1024 Len=0 MSS=1460
    107 14.360803996   192.168.2.219         192.168.2.15          TCP      58     39739 → 91 [SYN] Seq=0 Win=1024 Len=0 MSS=1460
    108 14.360811511   192.168.2.219         192.168.2.15          TCP      58     39739 → 70 [SYN] Seq=0 Win=1024 Len=0 MSS=1460
    109 14.360818652   192.168.2.219         192.168.2.15          TCP      58     39739 → 50 [SYN] Seq=0 Win=1024 Len=0 MSS=1460
    110 14.360826028   192.168.2.219         192.168.2.15          TCP      58     39739 → 99 [SYN] Seq=0 Win=1024 Len=0 MSS=1460
    111 14.360832378   192.168.2.219         192.168.2.15          TCP      58     39739 → 89 [SYN] Seq=0 Win=1024 Len=0 MSS=1460
    112 14.360838923   192.168.2.219         192.168.2.15          TCP      58     39739 → 86 [SYN] Seq=0 Win=1024 Len=0 MSS=1460
    113 14.360846599   192.168.2.219         192.168.2.15          TCP      58     39739 → 75 [SYN] Seq=0 Win=1024 Len=0 MSS=1460
    114 14.360854224   192.168.2.219         192.168.2.15          TCP      58     39739 → 54 [SYN] Seq=0 Win=1024 Len=0 MSS=1460
    115 14.360860505   192.168.2.219         192.168.2.15          TCP      58     39739 → 73 [SYN] Seq=0 Win=1024 Len=0 MSS=1460
    116 14.360867165   192.168.2.219         192.168.2.15          TCP      58     39739 → 83 [SYN] Seq=0 Win=1024 Len=0 MSS=1460
    117 14.360874576   192.168.2.219         192.168.2.15          TCP      58     39739 → 43 [SYN] Seq=0 Win=1024 Len=0 MSS=1460
    118 14.360881906   192.168.2.219         192.168.2.15          TCP      58     39739 → 65 [SYN] Seq=0 Win=1024 Len=0 MSS=1460
    119 14.360887987   192.168.2.219         192.168.2.15          TCP      58     39739 → 60 [SYN] Seq=0 Win=1024 Len=0 MSS=1460
    120 14.360894527   192.168.2.219         192.168.2.15          TCP      58     39739 → 84 [SYN] Seq=0 Win=1024 Len=0 MSS=1460
    121 14.360902333   192.168.2.219         192.168.2.15          TCP      58     39739 → 36 [SYN] Seq=0 Win=1024 Len=0 MSS=1460
    122 14.360911408   192.168.2.219         192.168.2.15          TCP      58     39739 → 2 [SYN] Seq=0 Win=1024 Len=0 MSS=1460
    123 14.360917814   192.168.2.219         192.168.2.15          TCP      58     39739 → 29 [SYN] Seq=0 Win=1024 Len=0 MSS=1460
    124 14.360924409   192.168.2.219         192.168.2.15          TCP      58     39739 → 97 [SYN] Seq=0 Win=1024 Len=0 MSS=1460
    125 14.360930705   192.168.2.219         192.168.2.15          TCP      58     39739 → 96 [SYN] Seq=0 Win=1024 Len=0 MSS=1460
    126 14.360938645   192.168.2.219         192.168.2.15          TCP      58     39739 → 45 [SYN] Seq=0 Win=1024 Len=0 MSS=1460
    127 14.360946116   192.168.2.219         192.168.2.15          TCP      58     39739 → 48 [SYN] Seq=0 Win=1024 Len=0 MSS=1460
    128 14.360952881   192.168.2.219         192.168.2.15          TCP      58     39739 → 6 [SYN] Seq=0 Win=1024 Len=0 MSS=1460
    129 14.360958946   192.168.2.219         192.168.2.15          TCP      58     39739 → 61 [SYN] Seq=0 Win=1024 Len=0 MSS=1460
    130 14.360965092   192.168.2.219         192.168.2.15          TCP      58     39739 → 57 [SYN] Seq=0 Win=1024 Len=0 MSS=1460
    131 14.360972232   192.168.2.219         192.168.2.15          TCP      58     39739 → 40 [SYN] Seq=0 Win=1024 Len=0 MSS=1460
    132 14.360978548   192.168.2.219         192.168.2.15          TCP      58     39739 → 26 [SYN] Seq=0 Win=1024 Len=0 MSS=1460
    133 14.360985548   192.168.2.219         192.168.2.15          TCP      58     39739 → 38 [SYN] Seq=0 Win=1024 Len=0 MSS=1460
    134 14.360993234   192.168.2.219         192.168.2.15          TCP      58     39739 → 63 [SYN] Seq=0 Win=1024 Len=0 MSS=1460
    135 14.361000344   192.168.2.219         192.168.2.15          TCP      58     39739 → 46 [SYN] Seq=0 Win=1024 Len=0 MSS=1460
    136 14.361007210   192.168.2.219         192.168.2.15          TCP      58     39739 → 11 [SYN] Seq=0 Win=1024 Len=0 MSS=1460
    137 14.361013805   192.168.2.219         192.168.2.15          TCP      58     39739 → 58 [SYN] Seq=0 Win=1024 Len=0 MSS=1460
    138 14.361021896   192.168.2.219         192.168.2.15          TCP      58     39739 → 9 [SYN] Seq=0 Win=1024 Len=0 MSS=1460
    139 14.361029451   192.168.2.219         192.168.2.15          TCP      58     39739 → 33 [SYN] Seq=0 Win=1024 Len=0 MSS=1460
    140 14.361035596   192.168.2.219         192.168.2.15          TCP      58     39739 → 27 [SYN] Seq=0 Win=1024 Len=0 MSS=1460
    141 14.361041947   192.168.2.219         192.168.2.15          TCP      58     39739 → 56 [SYN] Seq=0 Win=1024 Len=0 MSS=1460
    142 14.361049067   192.168.2.219         192.168.2.15          TCP      58     39739 → 93 [SYN] Seq=0 Win=1024 Len=0 MSS=1460
    228 14.458786566   192.168.2.219         192.168.2.15          TCP      58     39740 → 76 [SYN] Seq=0 Win=1024 Len=0 MSS=1460
    229 14.458824403   192.168.2.219         192.168.2.15          TCP      58     39740 → 95 [SYN] Seq=0 Win=1024 Len=0 MSS=1460
    230 14.458832639   192.168.2.219         192.168.2.15          TCP      58     39740 → 44 [SYN] Seq=0 Win=1024 Len=0 MSS=1460
    231 14.458841189   192.168.2.219         192.168.2.15          TCP      58     39740 → 52 [SYN] Seq=0 Win=1024 Len=0 MSS=1460
    232 14.458848715   192.168.2.219         192.168.2.15          TCP      58     39740 → 39 [SYN] Seq=0 Win=1024 Len=0 MSS=1460
    233 14.458858316   192.168.2.219         192.168.2.15          TCP      58     39740 → 72 [SYN] Seq=0 Win=1024 Len=0 MSS=1460
    234 14.458866161   192.168.2.219         192.168.2.15          TCP      58     39740 → 1 [SYN] Seq=0 Win=1024 Len=0 MSS=1460
    235 14.458873877   192.168.2.219         192.168.2.15          TCP      58     39740 → 18 [SYN] Seq=0 Win=1024 Len=0 MSS=1460
    236 14.458881907   192.168.2.219         192.168.2.15          TCP      58     39740 → 17 [SYN] Seq=0 Win=1024 Len=0 MSS=1460
    246 14.461194883   192.168.2.219         192.168.2.15          TCP      58     39740 → 93 [SYN] Seq=0 Win=1024 Len=0 MSS=1460
    247 14.461232111   192.168.2.219         192.168.2.15          TCP      58     39740 → 56 [SYN] Seq=0 Win=1024 Len=0 MSS=1460
    248 14.461240681   192.168.2.219         192.168.2.15          TCP      58     39740 → 27 [SYN] Seq=0 Win=1024 Len=0 MSS=1460
    249 14.461247312   192.168.2.219         192.168.2.15          TCP      58     39740 → 33 [SYN] Seq=0 Win=1024 Len=0 MSS=1460
    250 14.461257232   192.168.2.219         192.168.2.15          TCP      58     39740 → 9 [SYN] Seq=0 Win=1024 Len=0 MSS=1460
    251 14.461264503   192.168.2.219         192.168.2.15          TCP      58     39740 → 58 [SYN] Seq=0 Win=1024 Len=0 MSS=1460
    252 14.461270848   192.168.2.219         192.168.2.15          TCP      58     39740 → 11 [SYN] Seq=0 Win=1024 Len=0 MSS=1460
    253 14.461279794   192.168.2.219         192.168.2.15          TCP      58     39740 → 46 [SYN] Seq=0 Win=1024 Len=0 MSS=1460
    254 14.461286564   192.168.2.219         192.168.2.15          TCP      58     39740 → 63 [SYN] Seq=0 Win=1024 Len=0 MSS=1460
    255 14.461293670   192.168.2.219         192.168.2.15          TCP      58     39740 → 38 [SYN] Seq=0 Win=1024 Len=0 MSS=1460
    256 14.461301280   192.168.2.219         192.168.2.15          TCP      58     39740 → 26 [SYN] Seq=0 Win=1024 Len=0 MSS=1460
    257 14.461307641   192.168.2.219         192.168.2.15          TCP      58     39740 → 40 [SYN] Seq=0 Win=1024 Len=0 MSS=1460
    258 14.461316816   192.168.2.219         192.168.2.15          TCP      58     39740 → 57 [SYN] Seq=0 Win=1024 Len=0 MSS=1460
    259 14.461324187   192.168.2.219         192.168.2.15          TCP      58     39740 → 61 [SYN] Seq=0 Win=1024 Len=0 MSS=1460
    260 14.461330842   192.168.2.219         192.168.2.15          TCP      58     39740 → 6 [SYN] Seq=0 Win=1024 Len=0 MSS=1460
    261 14.461338308   192.168.2.219         192.168.2.15          TCP      58     39740 → 48 [SYN] Seq=0 Win=1024 Len=0 MSS=1460
    262 14.461345693   192.168.2.219         192.168.2.15          TCP      58     39740 → 45 [SYN] Seq=0 Win=1024 Len=0 MSS=1460
    263 14.461353019   192.168.2.219         192.168.2.15          TCP      58     39740 → 96 [SYN] Seq=0 Win=1024 Len=0 MSS=1460
    264 14.461360689   192.168.2.219         192.168.2.15          TCP      58     39740 → 97 [SYN] Seq=0 Win=1024 Len=0 MSS=1460
    265 14.461367190   192.168.2.219         192.168.2.15          TCP      58     39740 → 29 [SYN] Seq=0 Win=1024 Len=0 MSS=1460
    266 14.461374400   192.168.2.219         192.168.2.15          TCP      58     39740 → 2 [SYN] Seq=0 Win=1024 Len=0 MSS=1460
    267 14.461381051   192.168.2.219         192.168.2.15          TCP      58     39740 → 36 [SYN] Seq=0 Win=1024 Len=0 MSS=1460
    268 14.461388426   192.168.2.219         192.168.2.15          TCP      58     39740 → 84 [SYN] Seq=0 Win=1024 Len=0 MSS=1460
    269 14.461396057   192.168.2.219         192.168.2.15          TCP      58     39740 → 60 [SYN] Seq=0 Win=1024 Len=0 MSS=1460
    270 14.461402772   192.168.2.219         192.168.2.15          TCP      58     39740 → 65 [SYN] Seq=0 Win=1024 Len=0 MSS=1460
    271 14.461409192   192.168.2.219         192.168.2.15          TCP      58     39740 → 43 [SYN] Seq=0 Win=1024 Len=0 MSS=1460
    272 14.461415498   192.168.2.219         192.168.2.15          TCP      58     39740 → 83 [SYN] Seq=0 Win=1024 Len=0 MSS=1460
    273 14.461421963   192.168.2.219         192.168.2.15          TCP      58     39740 → 73 [SYN] Seq=0 Win=1024 Len=0 MSS=1460
    274 14.461428134   192.168.2.219         192.168.2.15          TCP      58     39740 → 54 [SYN] Seq=0 Win=1024 Len=0 MSS=1460
    275 14.461435484   192.168.2.219         192.168.2.15          TCP      58     39740 → 75 [SYN] Seq=0 Win=1024 Len=0 MSS=1460
    276 14.461442665   192.168.2.219         192.168.2.15          TCP      58     39740 → 86 [SYN] Seq=0 Win=1024 Len=0 MSS=1460
    277 14.461449260   192.168.2.219         192.168.2.15          TCP      58     39740 → 89 [SYN] Seq=0 Win=1024 Len=0 MSS=1460
    278 14.461458051   192.168.2.219         192.168.2.15          TCP      58     39740 → 99 [SYN] Seq=0 Win=1024 Len=0 MSS=1460
    279 14.461464846   192.168.2.219         192.168.2.15          TCP      58     39740 → 50 [SYN] Seq=0 Win=1024 Len=0 MSS=1460
    280 14.461471907   192.168.2.219         192.168.2.15          TCP      58     39740 → 70 [SYN] Seq=0 Win=1024 Len=0 MSS=1460
    281 14.461478612   192.168.2.219         192.168.2.15          TCP      58     39740 → 91 [SYN] Seq=0 Win=1024 Len=0 MSS=1460
    282 14.461485433   192.168.2.219         192.168.2.15          TCP      58     39740 → 47 [SYN] Seq=0 Win=1024 Len=0 MSS=1460
    283 14.461492223   192.168.2.219         192.168.2.15          TCP      58     39740 → 37 [SYN] Seq=0 Win=1024 Len=0 MSS=1460
    284 14.461498514   192.168.2.219         192.168.2.15          TCP      58     39740 → 4 [SYN] Seq=0 Win=1024 Len=0 MSS=1460
    285 14.461506854   192.168.2.219         192.168.2.15          TCP      58     39740 → 74 [SYN] Seq=0 Win=1024 Len=0 MSS=1460
