No.     Time           Source                Destination           Protocol Length Info
     32 13.287170377   192.168.2.219         192.168.2.15          TCP      58     52091 → 25 [SYN] Seq=0 Win=1024 Len=0 MSS=1460
     33 13.287204372   192.168.2.219         192.168.2.15          TCP      58     52091 → 22 [SYN] Seq=0 Win=1024 Len=0 MSS=1460
     34 13.287213857   192.168.2.219         192.168.2.15          TCP      58     52091 → 21 [SYN] Seq=0 Win=1024 Len=0 MSS=1460
     35 13.287220773   192.168.2.219         192.168.2.15          TCP      58     52091 → 80 [SYN] Seq=0 Win=1024 Len=0 MSS=1460
     36 13.287229593   192.168.2.219         192.168.2.15          TCP      58     52091 → 23 [SYN] Seq=0 Win=1024 Len=0 MSS=1460
     37 13.287238438   192.168.2.219         192.168.2.15          TCP      58     52091 → 53 [SYN] Seq=0 Win=1024 Len=0 MSS=1460
     38 13.287245923   192.168.2.219         192.168.2.15          TCP      58     52091 → 73 [SYN] Seq=0 Win=1024 Len=0 MSS=1460
     39 13.287253003   192.168.2.219         192.168.2.15          TCP      58     52091 → 30 [SYN] Seq=0 Win=1024 Len=0 MSS=1460
     40 13.287259844   192.168.2.219         192.168.2.15          TCP      58     52091 → 78 [SYN] Seq=0 Win=1024 Len=0 MSS=1460
     41 13.287268349   192.168.2.219         192.168.2.15          TCP      58     52091 → 47 [SYN] Seq=0 Win=1024 Len=0 MSS=1460
     48 13.288262860   192.168.2.219         192.168.2.15          TCP      54     52091 → 22 [RST] Seq=1 Win=0 Len=0
     51 13.288273805   192.168.2.219         192.168.2.15          TCP      54     52091 → 80 [RST] Seq=1 Win=0 Len=0
     54 14.388343269   192.168.2.219         192.168.2.15          TCP      58     52091 → 19 [SYN] Seq=0 Win=1024 Len=0 MSS=1460
     55 14.388355787   192.168.2.219         192.168.2.15          TCP      58     52091 → 20 [SYN] Seq=0 Win=1024 Len=0 MSS=1460
     56 14.388360395   192.168.2.219         192.168.2.15          TCP      58     52091 → 31 [SYN] Seq=0 Win=1024 Len=0 MSS=1460
     57 14.388365279   192.168.2.219         192.168.2.15          TCP      58     52091 → 83 [SYN] Seq=0 Win=1024 Len=0 MSS=1460
     58 14.388369855   192.168.2.219         192.168.2.15          TCP      58     52091 → 89 [SYN] Seq=0 Win=1024 Len=0 MSS=1460
     59 14.388374265   192.168.2.219         192.168.2.15          TCP      58     52091 → 86 [SYN] Seq=0 Win=1024 Len=0 MSS=1460
     60 14.388379205   192.168.2.219         192.168.2.15          TCP      58     52091 → 88 [SYN] Seq=0 Win=1024 Len=0 MSS=1460
     61 14.388383533   192.168.2.219         192.168.2.15          TCP      58     52091 → 62 [SYN] Seq=0 Win=1024 Len=0 MSS=1460
     62 14.388386940   192.168.2.219         192.168.2.15          TCP      58     52091 → 94 [SYN] Seq=0 Win=1024 Len=0 MSS=1460
     63 14.388390893   192.168.2.219         192.168.2.15          TCP      58     52091 → 71 [SYN] Seq=0 Win=1024 Len=0 MSS=1460
     64 14.388394575   192.168.2.219         192.168.2.15          TCP      58     52091 → 8 [SYN] Seq=0 Win=1024 Len=0 MSS=1460
     65 14.388397688   192.168.2.219         192.168.2.15          TCP      58     52091 → 37 [SYN] Seq=0 Win=1024 Len=0 MSS=1460
     66 14.388401958   192.168.2.219         192.168.2.15          TCP      58     52091 → 66 [SYN] Seq=0 Win=1024 Len=0 MSS=1460
     67 14.388405605   192.168.2.219         192.168.2.15          TCP      58     52091 → 100 [SYN] Seq=0 Win=1024 Len=0 MSS=1460
     68 14.388408778   192.168.2.219         192.168.2.15          TCP      58     52091 → 24 [SYN] Seq=0 Win=1024 Len=0 MSS=1460
     69 14.388411858   192.168.2.219         192.168.2.15          TCP      58     52091 → 74 [SYN] Seq=0 Win=1024 Len=0 MSS=1460
     70 14.388415698   192.168.2.219         192.168.2.15          TCP      58     52091 → 51 [SYN] Seq=0 Win=1024 Len=0 MSS=1460
     71 14.388419264   192.168.2.219         192.168.2.15          TCP      58     52091 → 3 [SYN] Seq=0 Win=1024 Len=0 MSS=1460
     72 14.388422924   192.168.2.219         192.168.2.15          TCP      58     52091 → 17 [SYN] Seq=0 Win=1024 Len=0 MSS=1460
     73 14.388426148   192.168.2.219         192.168.2.15          TCP      58     52091 → 72 [SYN] Seq=0 Win=1024 Len=0 MSS=1460
     74 14.388430316   192.168.2.219         192.168.2.15          TCP      58     52091 → 68 [SYN] Seq=0 Win=1024 Len=0 MSS=1460
     75 14.388434118   192.168.2.219         192.168.2.15          TCP      58     52091 → 46 [SYN] Seq=0 Win=1024 Len=0 MSS=1460
     76 14.388437826   192.168.2.219         192.168.2.15          TCP      58     52091 → 52 [SYN] Seq=0 Win=1024 Len=0 MSS=1460
     77 14.388440934   192.168.2.219         192.168.2.15          TCP      58     52091 → 99 [SYN] Seq=0 Win=1024 Len=0 MSS=1460
     78 14.388445169   192.168.2.219         192.168.2.15          TCP      58     52091 → 39 [SYN] Seq=0 Win=1024 Len=0 MSS=1460
     79 14.388448486   192.168.2.219         192.168.2.15          TCP      58     52091 → 58 [SYN] Seq=0 Win=1024 Len=0 MSS=1460
     80 14.388451531   192.168.2.219         192.168.2.15          TCP      58     52091 → 59 [SYN] Seq=0 Win=1024 Len=0 MSS=1460
     81 14.388455604   192.168.2.219         192.168.2.15          TCP      58     52091 → 70 [SYN] Seq=0 Win=1024 Len=0 MSS=1460
     82 14.388458929   192.168.2.219         192.168.2.15          TCP      58     52091 → 85 [SYN] Seq=0 Win=1024 Len=0 MSS=1460
     83 14.388462129   192.168.2.219         192.168.2.15          TCP      58     52091 → 1 [SYN] Seq=0 Win=1024 Len=0 MSS=1460
     84 14.388465327   192.168.2.219         192.168.2.15          TCP      58     52091 → 54 [SYN] Seq=0 Win=1024 Len=0 MSS=1460
     85 14.388469831   192.168.2.219         192.168.2.15          TCP      58     52091 → 5 [SYN] Seq=0 Win=1024 Len=0 MSS=1460
     86 14.388472897   192.168.2.219         192.168.2.15          TCP      58     52091 → 40 [SYN] Seq=0 Win=1024 Len=0 MSS=1460
     87 14.388476827   192.168.2.219         192.168.2.15          TCP      58     52091 → 6 [SYN] Seq=0 Win=1024 Len=0 MSS=1460
     88 14.388481662   192.168.2.219         192.168.2.15          TCP      58     52091 → 63 [SYN] Seq=0 Win=1024 Len=0 MSS=1460
     89 14.388485402   192.168.2.219         192.168.2.15          TCP      58     52091 → 81 [SYN] Seq=0 Win=1024 Len=0 MSS=1460
     90 14.388488577   192.168.2.219         192.168.2.15          TCP      58     52091 → 33 [SYN] Seq=0 Win=1024 Len=0 MSS=1460
     91 14.388491752   192.168.2.219         192.168.2.15          TCP      58     52091 → 90 [SYN] Seq=0 Win=1024 Len=0 MSS=1460
     92 14.388496142   192.168.2.219         192.168.2.15          TCP      58     52091 → 38 [SYN] Seq=0 Win=1024 Len=0 MSS=1460
     93 14.388499347   192.168.2.219         192.168.2.15          TCP      58     52091 → 9 [SYN] Seq=0 Win=1024 Len=0 MSS=1460
     94 14.388502535   192.168.2.219         192.168.2.15          TCP      58     52091 → 29 [SYN] Seq=0 Win=1024 Len=0 MSS=1460
     95 14.388505652   192.168.2.219         192.168.2.15          TCP      58     52091 → 84 [SYN] Seq=0 Win=1024 Len=0 MSS=1460
     96 14.388509710   192.168.2.219         192.168.2.15          TCP      58     52091 → 42 [SYN] Seq=0 Win=1024 Len=0 MSS=1460
     97 14.388513512   192.168.2.219         192.168.2.15          TCP      58     52091 → 48 [SYN] Seq=0 Win=1024 Len=0 MSS=1460
     98 14.388516778   192.168.2.219         192.168.2.15          TCP      58     52091 → 97 [SYN] Seq=0 Win=1024 Len=0 MSS=1460
     99 14.388519852   192.168.2.219         192.168.2.15          TCP      58     52091 → 91 [SYN] Seq=0 Win=1024 Len=0 MSS=1460
    100 14.388667043   192.168.2.219         192.168.2.15          TCP      58     52091 → 49 [SYN] Seq=0 Win=1024 Len=0 MSS=1460
    101 14.388672191   192.168.2.219         192.168.2.15          TCP      58     52091 → 4 [SYN] Seq=0 Win=1024 Len=0 MSS=1460
    102 14.388673191   192.168.2.219         192.168.2.15          TCP      58     52091 → 65 [SYN] Seq=0 Win=1024 Len=0 MSS=1460
    103 14.388674219   192.168.2.219         192.168.2.15          TCP      58     52091 → 35 [SYN] Seq=0 Win=1024 Len=0 MSS=1460
    104 14.390665805   192.168.2.219         192.168.2.15          TCP      58     52091 → 43 [SYN] Seq=0 Win=1024 Len=0 MSS=1460
    105 14.390680951   192.168.2.219         192.168.2.15          TCP      58     52091 → 36 [SYN] Seq=0 Win=1024 Len=0 MSS=1460
    106 14.390687093   192.168.2.219         192.168.2.15          TCP      58     52091 → 57 [SYN] Seq=0 Win=1024 Len=0 MSS=1460
    107 14.390690764   192.168.2.219         192.168.2.15          TCP      58     52091 → 2 [SYN] Seq=0 Win=1024 Len=0 MSS=1460
    108 14.390695354   192.168.2.219         192.168.2.15          TCP      58     52091 → 75 [SYN] Seq=0 Win=1024 Len=0 MSS=1460
    109 14.390699036   192.168.2.219         192.168.2.15          TCP      58     52091 → 34 [SYN] Seq=0 Win=1024 Len=0 MSS=1460
    110 14.390703082   192.168.2.219         192.168.2.15          TCP      58     52091 → 79 [SYN] Seq=0 Win=1024 Len=0 MSS=1460
    111 14.390706648   192.168.2.219         192.168.2.15          TCP      58     52091 → 11 [SYN] Seq=0 Win=1024 Len=0 MSS=1460
    112 14.390710604   192.168.2.219         192.168.2.15          TCP      58     52091 → 10 [SYN] Seq=0 Win=1024 Len=0 MSS=1460
    113 14.390715266   192.168.2.219         192.168.2.15          TCP      58     52091 → 77 [SYN] Seq=0 Win=1024 Len=0 MSS=1460
    114 14.390719049   192.168.2.219         192.168.2.15          TCP      58     52091 → 56 [SYN] Seq=0 Win=1024 Len=0 MSS=1460
    115 14.390722499   192.168.2.219         192.168.2.15          TCP      58     52091 → 95 [SYN] Seq=0 Win=1024 Len=0 MSS=1460
    116 14.390725662   192.168.2.219         192.168.2.15          TCP      58     52091 → 96 [SYN] Seq=0 Win=1024 Len=0 MSS=1460
    117 14.390729759   192.168.2.219         192.168.2.15          TCP      58     52091 → 28 [SYN] Seq=0 Win=1024 Len=0 MSS=1460
    118 14.390734752   192.168.2.219         192.168.2.15          TCP      58     52091 → 44 [SYN] Seq=0 Win=1024 Len=0 MSS=1460
    119 14.390738179   192.168.2.219         192.168.2.15          TCP      58     52091 → 18 [SYN] Seq=0 Win=1024 Len=0 MSS=1460
    120 14.390741327   192.168.2.219         192.168.2.15          TCP      58     52091 → 13 [SYN] Seq=0 Win=1024 Len=0 MSS=1460
    121 14.390744909   192.168.2.219         192.168.2.15          TCP      58     52091 → 26 [SYN] Seq=0 Win=1024 Len=0 MSS=1460
    122 14.390748867   192.168.2.219         192.168.2.15          TCP      58     52091 → 82 [SYN] Seq=0 Win=1024 Len=0 MSS=1460
    123 14.390752313   192.168.2.219         192.168.2.15          TCP      58     52091 → 41 [SYN] Seq=0 Win=1024 Len=0 MSS=1460
    124 14.390755713   192.168.2.219         192.168.2.15          TCP      58     52091 → 98 [SYN] Seq=0 Win=1024 Len=0 MSS=1460
    125 14.390759019   192.168.2.219         192.168.2.15          TCP      58     52091 → 16 [SYN] Seq=0 Win=1024 Len=0 MSS=1460
    126 14.390763453   192.168.2.219         192.168.2.15          TCP      58     52091 → 32 [SYN] Seq=0 Win=1024 Len=0 MSS=1460
    127 14.390767567   192.168.2.219         192.168.2.15          TCP      58     52091 → 64 [SYN] Seq=0 Win=1024 Len=0 MSS=1460
    128 14.390770933   192.168.2.219         192.168.2.15          TCP      58     52091 → 69 [SYN] Seq=0 Win=1024 Len=0 MSS=1460
    129 14.390774385   192.168.2.219         192.168.2.15          TCP      58     52091 → 12 [SYN] Seq=0 Win=1024 Len=0 MSS=1460
    130 14.390777805   192.168.2.219         192.168.2.15          TCP      58     52091 → 50 [SYN] Seq=0 Win=1024 Len=0 MSS=1460
    131 14.390782198   192.168.2.219         192.168.2.15          TCP      58     52091 → 87 [SYN] Seq=0 Win=1024 Len=0 MSS=1460
    132 14.390785668   192.168.2.219         192.168.2.15          TCP      58     52091 → 7 [SYN] Seq=0 Win=1024 Len=0 MSS=1460
    133 14.390789368   192.168.2.219         192.168.2.15          TCP      58     52091 → 60 [SYN] Seq=0 Win=1024 Len=0 MSS=1460
    134 14.390793380   192.168.2.219         192.168.2.15          TCP      58     52091 → 55 [SYN] Seq=0 Win=1024 Len=0 MSS=1460
    135 14.390796876   192.168.2.219         192.168.2.15          TCP      58     52091 → 93 [SYN] Seq=0 Win=1024 Len=0 MSS=1460
    136 14.390800046   192.168.2.219         192.168.2.15          TCP      58     52091 → 61 [SYN] Seq=0 Win=1024 Len=0 MSS=1460
    137 14.390803224   192.168.2.219         192.168.2.15          TCP      58     52091 → 15 [SYN] Seq=0 Win=1024 Len=0 MSS=1460
    138 14.390806901   192.168.2.219         192.168.2.15          TCP      58     52091 → 92 [SYN] Seq=0 Win=1024 Len=0 MSS=1460
    139 14.390810628   192.168.2.219         192.168.2.15          TCP      58     52091 → 14 [SYN] Seq=0 Win=1024 Len=0 MSS=1460
    140 14.390815081   192.168.2.219         192.168.2.15          TCP      58     52091 → 45 [SYN] Seq=0 Win=1024 Len=0 MSS=1460
    141 14.390819756   192.168.2.219         192.168.2.15          TCP      58     52091 → 67 [SYN] Seq=0 Win=1024 Len=0 MSS=1460
    142 14.390823671   192.168.2.219         192.168.2.15          TCP      58     52091 → 76 [SYN] Seq=0 Win=1024 Len=0 MSS=1460
    143 14.390828041   192.168.2.219         192.168.2.15          TCP      58     52091 → 27 [SYN] Seq=0 Win=1024 Len=0 MSS=1460
    234 14.488755137   192.168.2.219         192.168.2.15          TCP      58     52092 → 35 [SYN] Seq=0 Win=1024 Len=0 MSS=1460
    235 14.488772717   192.168.2.219         192.168.2.15          TCP      58     52092 → 65 [SYN] Seq=0 Win=1024 Len=0 MSS=1460
    236 14.488780154   192.168.2.219         192.168.2.15          TCP      58     52092 → 4 [SYN] Seq=0 Win=1024 Len=0 MSS=1460
    237 14.488787166   192.168.2.219         192.168.2.15          TCP      58     52092 → 49 [SYN] Seq=0 Win=1024 Len=0 MSS=1460
    238 14.488792534   192.168.2.219         192.168.2.15          TCP      58     52092 → 91 [SYN] Seq=0 Win=1024 Len=0 MSS=1460
    239 14.488797518   192.168.2.219         192.168.2.15          TCP      58     52092 → 97 [SYN] Seq=0 Win=1024 Len=0 MSS=1460
    240 14.488802574   192.168.2.219         192.168.2.15          TCP      58     52092 → 48 [SYN] Seq=0 Win=1024 Len=0 MSS=1460
    241 14.488809314   192.168.2.219         192.168.2.15          TCP      58     52092 → 42 [SYN] Seq=0 Win=1024 Len=0 MSS=1460
    242 14.488815374   192.168.2.219         192.168.2.15          TCP      58     52092 → 84 [SYN] Seq=0 Win=1024 Len=0 MSS=1460
    252 14.490915962   192.168.2.219         192.168.2.15          TCP      58     52092 → 27 [SYN] Seq=0 Win=1024 Len=0 MSS=1460
    253 14.490925771   192.168.2.219         192.168.2.15          TCP      58     52092 → 76 [SYN] Seq=0 Win=1024 Len=0 MSS=1460
    254 14.490932135   192.168.2.219         192.168.2.15          TCP      58     52092 → 67 [SYN] Seq=0 Win=1024 Len=0 MSS=1460
    255 14.490938911   192.168.2.219         192.168.2.15          TCP      58     52092 → 45 [SYN] Seq=0 Win=1024 Len=0 MSS=1460
    256 14.490944867   192.168.2.219         192.168.2.15          TCP      58     52092 → 14 [SYN] Seq=0 Win=1024 Len=0 MSS=1460
    257 14.490950671   192.168.2.219         192.168.2.15          TCP      58     52092 → 92 [SYN] Seq=0 Win=1024 Len=0 MSS=1460
    258 14.490955852   192.168.2.219         192.168.2.15          TCP      58     52092 → 15 [SYN] Seq=0 Win=1024 Len=0 MSS=1460
    259 14.490962812   192.168.2.219         192.168.2.15          TCP      58     52092 → 61 [SYN] Seq=0 Win=1024 Len=0 MSS=1460
    260 14.490968560   192.168.2.219         192.168.2.15          TCP      58     52092 → 93 [SYN] Seq=0 Win=1024 Len=0 MSS=1460
    261 14.490975196   192.168.2.219         192.168.2.15          TCP      58     52092 → 55 [SYN] Seq=0 Win=1024 Len=0 MSS=1460
    262 14.490982152   192.168.2.219         192.168.2.15          TCP      58     52092 → 60 [SYN] Seq=0 Win=1024 Len=0 MSS=1460
    263 14.490989628   192.168.2.219         192.168.2.15          TCP      58     52092 → 7 [SYN] Seq=0 Win=1024 Len=0 MSS=1460
    264 14.490997320   192.168.2.219         192.168.2.15          TCP      58     52092 → 87 [SYN] Seq=0 Win=1024 Len=0 MSS=1460
    265 14.491002456   192.168.2.219         192.168.2.15          TCP      58     52092 → 50 [SYN] Seq=0 Win=1024 Len=0 MSS=1460
    266 14.491007660   192.168.2.219         192.168.2.15          TCP      58     52092 → 12 [SYN] Seq=0 Win=1024 Len=0 MSS=1460
    267 14.491015121   192.168.2.219         192.168.2.15          TCP      58     52092 → 69 [SYN] Seq=0 Win=1024 Len=0 MSS=1460
    268 14.491020681   192.168.2.219         192.168.2.15          TCP      58     52092 → 64 [SYN] Seq=0 Win=1024 Len=0 MSS=1460
    269 14.491025761   192.168.2.219         192.168.2.15          TCP      58     52092 → 32 [SYN] Seq=0 Win=1024 Len=0 MSS=1460
    270 14.491032841   192.168.2.219         192.168.2.15          TCP      58     52092 → 16 [SYN] Seq=0 Win=1024 Len=0 MSS=1460
    271 14.491039817   192.168.2.219         192.168.2.15          TCP      58     52092 → 98 [SYN] Seq=0 Win=1024 Len=0 MSS=1460
    272 14.491045585   192.168.2.219         192.168.2.15          TCP      58     52092 → 41 [SYN] Seq=0 Win=1024 Len=0 MSS=1460
    273 14.491053137   192.168.2.219         192.168.2.15          TCP      58     52092 → 82 [SYN] Seq=0 Win=1024 Len=0 MSS=1460
    274 14.491059145   192.168.2.219         192.168.2.15          TCP      58     52092 → 26 [SYN] Seq=0 Win=1024 Len=0 MSS=1460
    275 14.491064834   192.168.2.219         192.168.2.15          TCP      58     52092 → 13 [SYN] Seq=0 Win=1024 Len=0 MSS=1460
    276 14.491069909   192.168.2.219         192.168.2.15          TCP      58     52092 → 18 [SYN] Seq=0 Win=1024 Len=0 MSS=1460
    277 14.491075066   192.168.2.219         192.168.2.15          TCP      58     52092 → 44 [SYN] Seq=0 Win=1024 Len=0 MSS=1460
    278 14.491079782   192.168.2.219         192.168.2.15          TCP      58     52092 → 28 [SYN] Seq=0 Win=1024 Len=0 MSS=1460
    279 14.491084410   192.168.2.219         192.168.2.15          TCP      58     52092 → 96 [SYN] Seq=0 Win=1024 Len=0 MSS=1460
    280 14.491090290   192.168.2.219         192.168.2.15          TCP      58     52092 → 95 [SYN] Seq=0 Win=1024 Len=0 MSS=1460
    281 14.491095826   192.168.2.219         192.168.2.15          TCP      58     52092 → 56 [SYN] Seq=0 Win=1024 Len=0 MSS=1460
    282 14.491102362   192.168.2.219         192.168.2.15          TCP      58     52092 → 77 [SYN] Seq=0 Win=1024 Len=0 MSS=1460
    283 14.491108363   192.168.2.219         192.168.2.15          TCP      58     52092 → 10 [SYN] Seq=0 Win=1024 Len=0 MSS=1460
    284 14.491113219   192.168.2.219         192.168.2.15          TCP      58     52092 → 11 [SYN] Seq=0 Win=1024 Len=0 MSS=1460
    285 14.491119483   192.168.2.219         192.168.2.15          TCP      58     52092 → 79 [SYN] Seq=0 Win=1024 Len=0 MSS=1460
    286 14.491124283   192.168.2.219         192.168.2.15          TCP      58     52092 → 34 [SYN] Seq=0 Win=1024 Len=0 MSS=1460
    287 14.491129103   192.168.2.219         192.168.2.15          TCP      58     52092 → 75 [SYN] Seq=0 Win=1024 Len=0 MSS=1460
    288 14.491133959   192.168.2.219         192.168.2.15          TCP      58     52092 → 2 [SYN] Seq=0 Win=1024 Len=0 MSS=1460
    289 14.491139383   192.168.2.219         192.168.2.15          TCP      58     52092 → 57 [SYN] Seq=0 Win=1024 Len=0 MSS=1460
    290 14.491145467   192.168.2.219         192.168.2.15          TCP      58     52092 → 36 [SYN] Seq=0 Win=1024 Len=0 MSS=1460
    291 14.491151556   192.168.2.219         192.168.2.15          TCP      58     52092 → 43 [SYN] Seq=0 Win=1024 Len=0 MSS=1460
