No.     Time           Source                Destination           Protocol Length Info
     30 13.392727810   192.168.2.219         192.168.2.15          TCP      74     55554 → 22 [SYN] Seq=0 Win=29200 Len=0 MSS=1460 SACK_PERM=1 TSval=3673632804 TSecr=0 WS=128
     31 13.392738664   192.168.2.219         192.168.2.15          TCP      74     53154 → 21 [SYN] Seq=0 Win=29200 Len=0 MSS=1460 SACK_PERM=1 TSval=3673632804 TSecr=0 WS=128
     32 13.392745755   192.168.2.219         192.168.2.15          TCP      74     52538 → 23 [SYN] Seq=0 Win=29200 Len=0 MSS=1460 SACK_PERM=1 TSval=3673632804 TSecr=0 WS=128
     33 13.392753477   192.168.2.219         192.168.2.15          TCP      74     49550 → 25 [SYN] Seq=0 Win=29200 Len=0 MSS=1460 SACK_PERM=1 TSval=3673632804 TSecr=0 WS=128
     34 13.392761457   192.168.2.219         192.168.2.15          TCP      74     46184 → 53 [SYN] Seq=0 Win=29200 Len=0 MSS=1460 SACK_PERM=1 TSval=3673632804 TSecr=0 WS=128
     35 13.392770141   192.168.2.219         192.168.2.15          TCP      74     38310 → 94 [SYN] Seq=0 Win=29200 Len=0 MSS=1460 SACK_PERM=1 TSval=3673632804 TSecr=0 WS=128
     36 13.392866531   192.168.2.219         192.168.2.15          TCP      74     41720 → 12 [SYN] Seq=0 Win=29200 Len=0 MSS=1460 SACK_PERM=1 TSval=3673632804 TSecr=0 WS=128
     37 13.392869453   192.168.2.219         192.168.2.15          TCP      74     58470 → 10 [SYN] Seq=0 Win=29200 Len=0 MSS=1460 SACK_PERM=1 TSval=3673632804 TSecr=0 WS=128
     38 13.392869989   192.168.2.219         192.168.2.15          TCP      74     48842 → 95 [SYN] Seq=0 Win=29200 Len=0 MSS=1460 SACK_PERM=1 TSval=3673632804 TSecr=0 WS=128
     41 13.393708432   192.168.2.219         192.168.2.15          TCP      66     60136 → 80 [ACK] Seq=1 Ack=1 Win=29312 Len=0 TSval=3673632805 TSecr=3434958279
     42 13.393711445   192.168.2.219         192.168.2.15          TCP      66     55554 → 22 [ACK] Seq=1 Ack=1 Win=29312 Len=0 TSval=3673632805 TSecr=3434958279
     48 13.393793541   192.168.2.219         192.168.2.15          TCP      66     60136 → 80 [RST, ACK] Seq=1 Ack=1 Win=29312 Len=0 TSval=3673632805 TSecr=3434958279
     49 13.393817385   192.168.2.219         192.168.2.15          TCP      66     55554 → 22 [RST, ACK] Seq=1 Ack=1 Win=29312 Len=0 TSval=3673632805 TSecr=3434958279
     50 13.393879575   192.168.2.219         192.168.2.15          TCP      74     56190 → 91 [SYN] Seq=0 Win=29200 Len=0 MSS=1460 SACK_PERM=1 TSval=3673632805 TSecr=0 WS=128
     51 13.393889645   192.168.2.219         192.168.2.15          TCP      74     36080 → 82 [SYN] Seq=0 Win=29200 Len=0 MSS=1460 SACK_PERM=1 TSval=3673632805 TSecr=0 WS=128
     52 13.393897423   192.168.2.219         192.168.2.15          TCP      74     38356 → 90 [SYN] Seq=0 Win=29200 Len=0 MSS=1460 SACK_PERM=1 TSval=3673632805 TSecr=0 WS=128
     53 13.393904925   192.168.2.219         192.168.2.15          TCP      74     45660 → 99 [SYN] Seq=0 Win=29200 Len=0 MSS=1460 SACK_PERM=1 TSval=3673632805 TSecr=0 WS=128
     54 13.393913555   192.168.2.219         192.168.2.15          TCP      74     50394 → 17 [SYN] Seq=0 Win=29200 Len=0 MSS=1460 SACK_PERM=1 TSval=3673632805 TSecr=0 WS=128
     55 13.393921770   192.168.2.219         192.168.2.15          TCP      74     36366 → 28 [SYN] Seq=0 Win=29200 Len=0 MSS=1460 SACK_PERM=1 TSval=3673632805 TSecr=0 WS=128
     56 13.393930456   192.168.2.219         192.168.2.15          TCP      74     51414 → 88 [SYN] Seq=0 Win=29200 Len=0 MSS=1460 SACK_PERM=1 TSval=3673632805 TSecr=0 WS=128
     57 13.393938430   192.168.2.219         192.168.2.15          TCP      74     46974 → 60 [SYN] Seq=0 Win=29200 Len=0 MSS=1460 SACK_PERM=1 TSval=3673632805 TSecr=0 WS=128
     58 13.393945786   192.168.2.219         192.168.2.15          TCP      74     56570 → 32 [SYN] Seq=0 Win=29200 Len=0 MSS=1460 SACK_PERM=1 TSval=3673632805 TSecr=0 WS=128
     59 13.393954738   192.168.2.219         192.168.2.15          TCP      74     35578 → 59 [SYN] Seq=0 Win=29200 Len=0 MSS=1460 SACK_PERM=1 TSval=3673632805 TSecr=0 WS=128
     60 13.393962613   192.168.2.219         192.168.2.15          TCP      74     57532 → 46 [SYN] Seq=0 Win=29200 Len=0 MSS=1460 SACK_PERM=1 TSval=3673632805 TSecr=0 WS=128
     64 13.394014312   192.168.2.219         192.168.2.15          TCP      74     47166 → 49 [SYN] Seq=0 Win=29200 Len=0 MSS=1460 SACK_PERM=1 TSval=3673632805 TSecr=0 WS=128
     65 13.394015574   192.168.2.219         192.168.2.15          TCP      74     50450 → 1 [SYN] Seq=0 Win=29200 Len=0 MSS=1460 SACK_PERM=1 TSval=3673632805 TSecr=0 WS=128
     66 13.394016106   192.168.2.219         192.168.2.15          TCP      74     36954 → 58 [SYN] Seq=0 Win=29200 Len=0 MSS=1460 SACK_PERM=1 TSval=3673632805 TSecr=0 WS=128
     67 13.394089559   192.168.2.219         192.168.2.15          TCP      74     52506 → 92 [SYN] Seq=0 Win=29200 Len=0 MSS=1460 SACK_PERM=1 TSval=3673632805 TSecr=0 WS=128
     68 13.394102294   192.168.2.219         192.168.2.15          TCP      74     56048 → 84 [SYN] Seq=0 Win=29200 Len=0 MSS=1460 SACK_PERM=1 TSval=3673632805 TSecr=0 WS=128
     69 13.394109846   192.168.2.219         192.168.2.15          TCP      74     50504 → 79 [SYN] Seq=0 Win=29200 Len=0 MSS=1460 SACK_PERM=1 TSval=3673632805 TSecr=0 WS=128
     70 13.394116758   192.168.2.219         192.168.2.15          TCP      74     49600 → 64 [SYN] Seq=0 Win=29200 Len=0 MSS=1460 SACK_PERM=1 TSval=3673632805 TSecr=0 WS=128
     71 13.394124720   192.168.2.219         192.168.2.15          TCP      74     46502 → 56 [SYN] Seq=0 Win=29200 Len=0 MSS=1460 SACK_PERM=1 TSval=3673632805 TSecr=0 WS=128
     72 13.394132875   192.168.2.219         192.168.2.15          TCP      74     33696 → 73 [SYN] Seq=0 Win=29200 Len=0 MSS=1460 SACK_PERM=1 TSval=3673632805 TSecr=0 WS=128
     77 13.394797362   192.168.2.219         192.168.2.15          TCP      74     54240 → 93 [SYN] Seq=0 Win=29200 Len=0 MSS=1460 SACK_PERM=1 TSval=3673632805 TSecr=0 WS=128
     78 13.394809665   192.168.2.219         192.168.2.15          TCP      74     43720 → 27 [SYN] Seq=0 Win=29200 Len=0 MSS=1460 SACK_PERM=1 TSval=3673632805 TSecr=0 WS=128
     79 13.394817916   192.168.2.219         192.168.2.15          TCP      74     49306 → 3 [SYN] Seq=0 Win=29200 Len=0 MSS=1460 SACK_PERM=1 TSval=3673632805 TSecr=0 WS=128
     80 13.394825763   192.168.2.219         192.168.2.15          TCP      74     55504 → 50 [SYN] Seq=0 Win=29200 Len=0 MSS=1460 SACK_PERM=1 TSval=3673632805 TSecr=0 WS=128
     81 13.394832823   192.168.2.219         192.168.2.15          TCP      74     56726 → 13 [SYN] Seq=0 Win=29200 Len=0 MSS=1460 SACK_PERM=1 TSval=3673632805 TSecr=0 WS=128
     82 13.394840559   192.168.2.219         192.168.2.15          TCP      74     40142 → 41 [SYN] Seq=0 Win=29200 Len=0 MSS=1460 SACK_PERM=1 TSval=3673632805 TSecr=0 WS=128
     83 13.394848715   192.168.2.219         192.168.2.15          TCP      74     58464 → 74 [SYN] Seq=0 Win=29200 Len=0 MSS=1460 SACK_PERM=1 TSval=3673632805 TSecr=0 WS=128
     84 13.394857093   192.168.2.219         192.168.2.15          TCP      74     33620 → 69 [SYN] Seq=0 Win=29200 Len=0 MSS=1460 SACK_PERM=1 TSval=3673632805 TSecr=0 WS=128
     96 13.395797209   192.168.2.219         192.168.2.15          TCP      74     43962 → 31 [SYN] Seq=0 Win=29200 Len=0 MSS=1460 SACK_PERM=1 TSval=3673632805 TSecr=0 WS=128
     97 13.395808477   192.168.2.219         192.168.2.15          TCP      74     37452 → 48 [SYN] Seq=0 Win=29200 Len=0 MSS=1460 SACK_PERM=1 TSval=3673632805 TSecr=0 WS=128
     98 13.395815720   192.168.2.219         192.168.2.15          TCP      74     49916 → 33 [SYN] Seq=0 Win=29200 Len=0 MSS=1460 SACK_PERM=1 TSval=3673632805 TSecr=0 WS=128
     99 13.395822800   192.168.2.219         192.168.2.15          TCP      74     40338 → 9 [SYN] Seq=0 Win=29200 Len=0 MSS=1460 SACK_PERM=1 TSval=3673632805 TSecr=0 WS=128
    100 13.395829542   192.168.2.219         192.168.2.15          TCP      74     33342 → 86 [SYN] Seq=0 Win=29200 Len=0 MSS=1460 SACK_PERM=1 TSval=3673632805 TSecr=0 WS=128
    101 13.395837014   192.168.2.219         192.168.2.15          TCP      74     49128 → 4 [SYN] Seq=0 Win=29200 Len=0 MSS=1460 SACK_PERM=1 TSval=3673632805 TSecr=0 WS=128
    102 13.395844632   192.168.2.219         192.168.2.15          TCP      74     42872 → 30 [SYN] Seq=0 Win=29200 Len=0 MSS=1460 SACK_PERM=1 TSval=3673632805 TSecr=0 WS=128
    103 13.395851795   192.168.2.219         192.168.2.15          TCP      74     34718 → 97 [SYN] Seq=0 Win=29200 Len=0 MSS=1460 SACK_PERM=1 TSval=3673632805 TSecr=0 WS=128
    104 13.395858902   192.168.2.219         192.168.2.15          TCP      74     37372 → 47 [SYN] Seq=0 Win=29200 Len=0 MSS=1460 SACK_PERM=1 TSval=3673632805 TSecr=0 WS=128
    105 13.395865639   192.168.2.219         192.168.2.15          TCP      74     32916 → 100 [SYN] Seq=0 Win=29200 Len=0 MSS=1460 SACK_PERM=1 TSval=3673632805 TSecr=0 WS=128
    106 13.395872433   192.168.2.219         192.168.2.15          TCP      74     34842 → 77 [SYN] Seq=0 Win=29200 Len=0 MSS=1460 SACK_PERM=1 TSval=3673632805 TSecr=0 WS=128
    107 13.395879537   192.168.2.219         192.168.2.15          TCP      74     54052 → 65 [SYN] Seq=0 Win=29200 Len=0 MSS=1460 SACK_PERM=1 TSval=3673632805 TSecr=0 WS=128
    108 13.395887139   192.168.2.219         192.168.2.15          TCP      74     55334 → 67 [SYN] Seq=0 Win=29200 Len=0 MSS=1460 SACK_PERM=1 TSval=3673632805 TSecr=0 WS=128
    109 13.395894741   192.168.2.219         192.168.2.15          TCP      74     49584 → 15 [SYN] Seq=0 Win=29200 Len=0 MSS=1460 SACK_PERM=1 TSval=3673632805 TSecr=0 WS=128
    110 13.395903090   192.168.2.219         192.168.2.15          TCP      74     44110 → 54 [SYN] Seq=0 Win=29200 Len=0 MSS=1460 SACK_PERM=1 TSval=3673632805 TSecr=0 WS=128
    111 13.395914442   192.168.2.219         192.168.2.15          TCP      74     47166 → 87 [SYN] Seq=0 Win=29200 Len=0 MSS=1460 SACK_PERM=1 TSval=3673632805 TSecr=0 WS=128
    112 13.395922096   192.168.2.219         192.168.2.15          TCP      74     47400 → 36 [SYN] Seq=0 Win=29200 Len=0 MSS=1460 SACK_PERM=1 TSval=3673632805 TSecr=0 WS=128
    113 13.395930631   192.168.2.219         192.168.2.15          TCP      74     41408 → 7 [SYN] Seq=0 Win=29200 Len=0 MSS=1460 SACK_PERM=1 TSval=3673632805 TSecr=0 WS=128
    114 13.396028677   192.168.2.219         192.168.2.15          TCP      74     45936 → 2 [SYN] Seq=0 Win=29200 Len=0 MSS=1460 SACK_PERM=1 TSval=3673632805 TSecr=0 WS=128
    115 13.396030771   192.168.2.219         192.168.2.15          TCP      74     48458 → 14 [SYN] Seq=0 Win=29200 Len=0 MSS=1460 SACK_PERM=1 TSval=3673632805 TSecr=0 WS=128
    116 13.396031297   192.168.2.219         192.168.2.15          TCP      74     42500 → 66 [SYN] Seq=0 Win=29200 Len=0 MSS=1460 SACK_PERM=1 TSval=3673632805 TSecr=0 WS=128
    117 13.396031725   192.168.2.219         192.168.2.15          TCP      74     58776 → 96 [SYN] Seq=0 Win=29200 Len=0 MSS=1460 SACK_PERM=1 TSval=3673632805 TSecr=0 WS=128
    129 13.396227089   192.168.2.219         192.168.2.15          TCP      74     37524 → 6 [SYN] Seq=0 Win=29200 Len=0 MSS=1460 SACK_PERM=1 TSval=3673632805 TSecr=0 WS=128
    130 13.396238018   192.168.2.219         192.168.2.15          TCP      74     36460 → 83 [SYN] Seq=0 Win=29200 Len=0 MSS=1460 SACK_PERM=1 TSval=3673632805 TSecr=0 WS=128
    131 13.396245596   192.168.2.219         192.168.2.15          TCP      74     53922 → 37 [SYN] Seq=0 Win=29200 Len=0 MSS=1460 SACK_PERM=1 TSval=3673632805 TSecr=0 WS=128
    132 13.396252760   192.168.2.219         192.168.2.15          TCP      74     59910 → 34 [SYN] Seq=0 Win=29200 Len=0 MSS=1460 SACK_PERM=1 TSval=3673632805 TSecr=0 WS=128
    133 13.396260028   192.168.2.219         192.168.2.15          TCP      74     34884 → 61 [SYN] Seq=0 Win=29200 Len=0 MSS=1460 SACK_PERM=1 TSval=3673632805 TSecr=0 WS=128
    134 13.396268120   192.168.2.219         192.168.2.15          TCP      74     47598 → 81 [SYN] Seq=0 Win=29200 Len=0 MSS=1460 SACK_PERM=1 TSval=3673632805 TSecr=0 WS=128
    135 13.396275990   192.168.2.219         192.168.2.15          TCP      74     51178 → 55 [SYN] Seq=0 Win=29200 Len=0 MSS=1460 SACK_PERM=1 TSval=3673632805 TSecr=0 WS=128
    136 13.396283472   192.168.2.219         192.168.2.15          TCP      74     60250 → 19 [SYN] Seq=0 Win=29200 Len=0 MSS=1460 SACK_PERM=1 TSval=3673632805 TSecr=0 WS=128
    137 13.396290267   192.168.2.219         192.168.2.15          TCP      74     34860 → 16 [SYN] Seq=0 Win=29200 Len=0 MSS=1460 SACK_PERM=1 TSval=3673632805 TSecr=0 WS=128
    138 13.396299409   192.168.2.219         192.168.2.15          TCP      74     38910 → 89 [SYN] Seq=0 Win=29200 Len=0 MSS=1460 SACK_PERM=1 TSval=3673632805 TSecr=0 WS=128
    139 13.396306767   192.168.2.219         192.168.2.15          TCP      74     54264 → 75 [SYN] Seq=0 Win=29200 Len=0 MSS=1460 SACK_PERM=1 TSval=3673632805 TSecr=0 WS=128
    140 13.396313300   192.168.2.219         192.168.2.15          TCP      74     40910 → 18 [SYN] Seq=0 Win=29200 Len=0 MSS=1460 SACK_PERM=1 TSval=3673632805 TSecr=0 WS=128
    141 13.396320284   192.168.2.219         192.168.2.15          TCP      74     36160 → 8 [SYN] Seq=0 Win=29200 Len=0 MSS=1460 SACK_PERM=1 TSval=3673632805 TSecr=0 WS=128
    142 13.396327593   192.168.2.219         192.168.2.15          TCP      74     49150 → 63 [SYN] Seq=0 Win=29200 Len=0 MSS=1460 SACK_PERM=1 TSval=3673632805 TSecr=0 WS=128
    143 13.396335758   192.168.2.219         192.168.2.15          TCP      74     60498 → 62 [SYN] Seq=0 Win=29200 Len=0 MSS=1460 SACK_PERM=1 TSval=3673632805 TSecr=0 WS=128
    144 13.396342410   192.168.2.219         192.168.2.15          TCP      74     46126 → 38 [SYN] Seq=0 Win=29200 Len=0 MSS=1460 SACK_PERM=1 TSval=3673632805 TSecr=0 WS=128
    145 13.396348870   192.168.2.219         192.168.2.15          TCP      74     41446 → 45 [SYN] Seq=0 Win=29200 Len=0 MSS=1460 SACK_PERM=1 TSval=3673632805 TSecr=0 WS=128
    146 13.396355939   192.168.2.219         192.168.2.15          TCP      74     41220 → 24 [SYN] Seq=0 Win=29200 Len=0 MSS=1460 SACK_PERM=1 TSval=3673632805 TSecr=0 WS=128
    147 13.396363766   192.168.2.219         192.168.2.15          TCP      74     42354 → 43 [SYN] Seq=0 Win=29200 Len=0 MSS=1460 SACK_PERM=1 TSval=3673632805 TSecr=0 WS=128
    148 13.396370852   192.168.2.219         192.168.2.15          TCP      74     50536 → 44 [SYN] Seq=0 Win=29200 Len=0 MSS=1460 SACK_PERM=1 TSval=3673632805 TSecr=0 WS=128
    149 13.396378207   192.168.2.219         192.168.2.15          TCP      74     52424 → 98 [SYN] Seq=0 Win=29200 Len=0 MSS=1460 SACK_PERM=1 TSval=3673632805 TSecr=0 WS=128
    150 13.396390427   192.168.2.219         192.168.2.15          TCP      74     40962 → 29 [SYN] Seq=0 Win=29200 Len=0 MSS=1460 SACK_PERM=1 TSval=3673632805 TSecr=0 WS=128
    157 13.396588350   192.168.2.219         192.168.2.15          TCP      74     60156 → 57 [SYN] Seq=0 Win=29200 Len=0 MSS=1460 SACK_PERM=1 TSval=3673632805 TSecr=0 WS=128
    158 13.396596598   192.168.2.219         192.168.2.15          TCP      74     38570 → 76 [SYN] Seq=0 Win=29200 Len=0 MSS=1460 SACK_PERM=1 TSval=3673632805 TSecr=0 WS=128
    159 13.396603850   192.168.2.219         192.168.2.15          TCP      74     48696 → 20 [SYN] Seq=0 Win=29200 Len=0 MSS=1460 SACK_PERM=1 TSval=3673632805 TSecr=0 WS=128
    160 13.396611305   192.168.2.219         192.168.2.15          TCP      74     36684 → 71 [SYN] Seq=0 Win=29200 Len=0 MSS=1460 SACK_PERM=1 TSval=3673632805 TSecr=0 WS=128
    161 13.396618194   192.168.2.219         192.168.2.15          TCP      74     58864 → 42 [SYN] Seq=0 Win=29200 Len=0 MSS=1460 SACK_PERM=1 TSval=3673632805 TSecr=0 WS=128
    162 13.396625335   192.168.2.219         192.168.2.15          TCP      74     36510 → 70 [SYN] Seq=0 Win=29200 Len=0 MSS=1460 SACK_PERM=1 TSval=3673632805 TSecr=0 WS=128
    163 13.396632017   192.168.2.219         192.168.2.15          TCP      74     50754 → 51 [SYN] Seq=0 Win=29200 Len=0 MSS=1460 SACK_PERM=1 TSval=3673632805 TSecr=0 WS=128
    164 13.396642257   192.168.2.219         192.168.2.15          TCP      74     59736 → 52 [SYN] Seq=0 Win=29200 Len=0 MSS=1460 SACK_PERM=1 TSval=3673632805 TSecr=0 WS=128
    165 13.396649967   192.168.2.219         192.168.2.15          TCP      74     60440 → 78 [SYN] Seq=0 Win=29200 Len=0 MSS=1460 SACK_PERM=1 TSval=3673632805 TSecr=0 WS=128
    166 13.396656827   192.168.2.219         192.168.2.15          TCP      74     58436 → 5 [SYN] Seq=0 Win=29200 Len=0 MSS=1460 SACK_PERM=1 TSval=3673632805 TSecr=0 WS=128
    167 13.396663959   192.168.2.219         192.168.2.15          TCP      74     54518 → 11 [SYN] Seq=0 Win=29200 Len=0 MSS=1460 SACK_PERM=1 TSval=3673632805 TSecr=0 WS=128
    168 13.396671552   192.168.2.219         192.168.2.15          TCP      74     35158 → 40 [SYN] Seq=0 Win=29200 Len=0 MSS=1460 SACK_PERM=1 TSval=3673632805 TSecr=0 WS=128
    180 13.398119053   192.168.2.219         192.168.2.15          TCP      74     50212 → 72 [SYN] Seq=0 Win=29200 Len=0 MSS=1460 SACK_PERM=1 TSval=3673632806 TSecr=0 WS=128
    181 13.398130862   192.168.2.219         192.168.2.15          TCP      74     54382 → 35 [SYN] Seq=0 Win=29200 Len=0 MSS=1460 SACK_PERM=1 TSval=3673632806 TSecr=0 WS=128
    182 13.398139096   192.168.2.219         192.168.2.15          TCP      74     36464 → 85 [SYN] Seq=0 Win=29200 Len=0 MSS=1460 SACK_PERM=1 TSval=3673632806 TSecr=0 WS=128
    183 13.398146248   192.168.2.219         192.168.2.15          TCP      74     53256 → 68 [SYN] Seq=0 Win=29200 Len=0 MSS=1460 SACK_PERM=1 TSval=3673632806 TSecr=0 WS=128
    184 13.398153286   192.168.2.219         192.168.2.15          TCP      74     38852 → 26 [SYN] Seq=0 Win=29200 Len=0 MSS=1460 SACK_PERM=1 TSval=3673632806 TSecr=0 WS=128
    185 13.398160241   192.168.2.219         192.168.2.15          TCP      74     53442 → 39 [SYN] Seq=0 Win=29200 Len=0 MSS=1460 SACK_PERM=1 TSval=3673632806 TSecr=0 WS=128
